Title,Tag,Title_and_tag,Link,Category,Author,Image
Plandemic: Fear Is the Virus. Truth Is the Cure.,"big,","Plandemic: Fear Is the Virus. Truth Is the Cure. big,",https://www.amazon.com/Plandemic-Fear-Virus-Truth-Cure/dp/1510765549/ref=sr_1_7?qid=1636073806&qsid=134-0882868-5928735&s=books&sr=1-7&sres=163149256X%2C0762499508%2C0063076098%2C1250765781%2C125083239X%2C1419732447%2C1510765549%2C0593577922%2C0935112960%2C0063090023%2C080241270X%2C0545231493%2C0692927999%2C1984877925%2C030692370X%2C1647224098,Arts & Photography,"Mikki Willis, ",https://m.media-amazon.com/images/I/71MFYGSqImL._AC_UY218_.jpg
The Beatles: Get Back,"alive, arrogant, popular, successful, great, absolute, song, good, track, main,","The Beatles: Get Back alive, arrogant, popular, successful, great, absolute, song, good, track, main,",https://www.amazon.com/The-Beatles-Get-Back/dp/0935112960/ref=sr_1_9?qid=1636073806&qsid=134-0882868-5928735&s=books&sr=1-9&sres=163149256X%2C0762499508%2C0063076098%2C1250765781%2C125083239X%2C1419732447%2C1510765549%2C0593577922%2C0935112960%2C0063090023%2C080241270X%2C0545231493%2C0692927999%2C1984877925%2C030692370X%2C1647224098,Arts & Photography,"John Harris, The Beatles, ",https://m.media-amazon.com/images/I/61EdzV5OPXS._AC_UY218_.jpg
Woke Up This Morning: The Definitive Oral History of The Sopranos,"potential, disappointing, large, literary, unique, evident, prior, sacred, bad, outer,","Woke Up This Morning: The Definitive Oral History of The Sopranos potential, disappointing, large, literary, unique, evident, prior, sacred, bad, outer,",https://www.amazon.com/Woke-Up-This-Morning-Definitive/dp/0063090023/ref=sr_1_10?qid=1636073806&qsid=134-0882868-5928735&s=books&sr=1-10&sres=163149256X%2C0762499508%2C0063076098%2C1250765781%2C125083239X%2C1419732447%2C1510765549%2C0593577922%2C0935112960%2C0063090023%2C080241270X%2C0545231493%2C0692927999%2C1984877925%2C030692370X%2C1647224098,Arts & Photography,"Michael Imperioli, Steve Schirripa, ",https://m.media-amazon.com/images/I/71MQ-G3kX1L._AC_UY218_.jpg
The 5 Love Languages: The Secret to Love that Lasts,"sexual, few, general, weekly, happy, emotional, abusive, physical, straight, outdated,","The 5 Love Languages: The Secret to Love that Lasts sexual, few, general, weekly, happy, emotional, abusive, physical, straight, outdated,",https://www.amazon.com/Love-Languages-Secret-that-Lasts/dp/080241270X/ref=sr_1_11?qid=1636073806&qsid=134-0882868-5928735&s=books&sr=1-11&sres=163149256X%2C0762499508%2C0063076098%2C1250765781%2C125083239X%2C1419732447%2C1510765549%2C0593577922%2C0935112960%2C0063090023%2C080241270X%2C0545231493%2C0692927999%2C1984877925%2C030692370X%2C1647224098,Arts & Photography,"Gary Chapman, ",https://m.media-amazon.com/images/I/81RuAzKrHkL._AC_UY218_.jpg
First Little Readers Parent Pack: Guided Reading Level A: 25 Irresistible Books That Are Just the Right Level for Beginning Readers,"good, particular, appropriate, new, licensed, high, consonant, -consonant, fine, absolute,","First Little Readers Parent Pack: Guided Reading Level A: 25 Irresistible Books That Are Just the Right Level for Beginning Readers good, particular, appropriate, new, licensed, high, consonant, -consonant, fine, absolute,",https://www.amazon.com/First-Little-Readers-Parent-Pack/dp/0545231493/ref=sr_1_12?qid=1636073806&qsid=134-0882868-5928735&s=books&sr=1-12&sres=163149256X%2C0762499508%2C0063076098%2C1250765781%2C125083239X%2C1419732447%2C1510765549%2C0593577922%2C0935112960%2C0063090023%2C080241270X%2C0545231493%2C0692927999%2C1984877925%2C030692370X%2C1647224098,Arts & Photography,"Deborah Schecter, ",https://m.media-amazon.com/images/I/71urLRbZzPL._AC_UY218_.jpg
"I Am Confident, Brave & Beautiful: A Coloring Book for Girls","simple, positive, nice, worth, little, old, double, short, inspirational, overstated,","I Am Confident, Brave & Beautiful: A Coloring Book for Girls simple, positive, nice, worth, little, old, double, short, inspirational, overstated,",https://www.amazon.com/Am-Confident-Brave-Beautiful-Coloring/dp/0692927999/ref=sr_1_13?qid=1636073806&qsid=134-0882868-5928735&s=books&sr=1-13&sres=163149256X%2C0762499508%2C0063076098%2C1250765781%2C125083239X%2C1419732447%2C1510765549%2C0593577922%2C0935112960%2C0063090023%2C080241270X%2C0545231493%2C0692927999%2C1984877925%2C030692370X%2C1647224098,Arts & Photography,"Hopscotch Girls, ",https://m.media-amazon.com/images/I/71AIzioFxTL._AC_UY218_.jpg
The First 21: How I Became Nikki Sixx,,The First 21: How I Became Nikki Sixx,https://www.amazon.com/First-21-Memoir-Lou-Carlton/dp/030692370X/ref=sr_1_15?qid=1636073806&qsid=134-0882868-5928735&s=books&sr=1-15&sres=163149256X%2C0762499508%2C0063076098%2C1250765781%2C125083239X%2C1419732447%2C1510765549%2C0593577922%2C0935112960%2C0063090023%2C080241270X%2C0545231493%2C0692927999%2C1984877925%2C030692370X%2C1647224098,Arts & Photography,"Nikki Sixx, ",https://m.media-amazon.com/images/I/912PeKo3SxS._AC_UY218_.jpg
Harry Potter: Holiday Magic: The Official Advent Calendar,"special, pre, poor, excited, amazing, total, decent, small, actual, old,","Harry Potter: Holiday Magic: The Official Advent Calendar special, pre, poor, excited, amazing, total, decent, small, actual, old,",https://www.amazon.com/Harry-Potter-Holiday-Official-Calendar/dp/1647224098/ref=sr_1_16?qid=1636073806&qsid=134-0882868-5928735&s=books&sr=1-16&sres=163149256X%2C0762499508%2C0063076098%2C1250765781%2C125083239X%2C1419732447%2C1510765549%2C0593577922%2C0935112960%2C0063090023%2C080241270X%2C0545231493%2C0692927999%2C1984877925%2C030692370X%2C1647224098,Arts & Photography,"Insight Editions, ",https://m.media-amazon.com/images/I/71vFCGqH6WS._AC_UY218_.jpg
"The Boy, the Mole, the Fox and the Horse","good, high, cute, old, simplistic, directionless, petty, glad, thoughtful, astounding,","The Boy, the Mole, the Fox and the Horse good, high, cute, old, simplistic, directionless, petty, glad, thoughtful, astounding,",https://www.amazon.com/Boy-Mole-Fox-Horse/dp/0062976583/ref=sr_1_1?qid=1636073928&s=books&sr=1-1,Comics & Graphic Novels,"Charlie Mackesy, ",https://m.media-amazon.com/images/I/71eJk7GtUOL._AC_UY218_.jpg
Lore Olympus: Volume One,"confused, related, favorite, 100th, missing, different, wrong, well, bent, honest,","Lore Olympus: Volume One confused, related, favorite, 100th, missing, different, wrong, well, bent, honest,",https://www.amazon.com/Lore-Olympus-One-Rachel-Smythe/dp/0593160290/ref=sr_1_2?qid=1636073928&s=books&sr=1-2,Comics & Graphic Novels,"Rachel Smythe, ",https://m.media-amazon.com/images/I/91ABnpxiy+L._AC_UY218_.jpg
The Far Side® 2022 Off-The-Wall Calendar,"cheap, disappointed, far, excited, entire, black, white, disappointing,","The Far Side® 2022 Off-The-Wall Calendar cheap, disappointed, far, excited, entire, black, white, disappointing,",https://www.amazon.com/Side%C2%AE-2022-Off-Wall-Calendar/dp/1524868663/ref=sr_1_3?qid=1636073928&s=books&sr=1-3,Comics & Graphic Novels,"Gary Larson, ",https://m.media-amazon.com/images/I/71ZFjExjngS._AC_UY218_.jpg
The Complete Calvin and Hobbes [Box Set],"right, wonderful, unacceptable, large, hardcover, noxious, fine, black, ok, enormous,","The Complete Calvin and Hobbes [Box Set] right, wonderful, unacceptable, large, hardcover, noxious, fine, black, ok, enormous,",https://www.amazon.com/Complete-Calvin-Hobbes-Box-Set/dp/0740748475/ref=sr_1_4?qid=1636073928&s=books&sr=1-4,Comics & Graphic Novels,"Bill Watterson, ",https://m.media-amazon.com/images/I/91Mbi5713JL._AC_UY218_.jpg
On Tyranny Graphic Edition: Twenty Lessons from the Twentieth Century,"disappointed, authoritarian, small, understandable, clear, illegible, conducive, black, dark, green,","On Tyranny Graphic Edition: Twenty Lessons from the Twentieth Century disappointed, authoritarian, small, understandable, clear, illegible, conducive, black, dark, green,",https://www.amazon.com/Tyranny-Graphic-Lessons-Twentieth-Century/dp/1984859153/ref=sr_1_5?qid=1636073928&s=books&sr=1-5,Comics & Graphic Novels,"Timothy Snyder, Nora Krug, ",https://m.media-amazon.com/images/I/91Am1et3RwL._AC_UY218_.jpg
Berserk Deluxe Volume 1,"awesome, stuck, black, red, large, sharp, well, original, sound, additional,","Berserk Deluxe Volume 1 awesome, stuck, black, red, large, sharp, well, original, sound, additional,",https://www.amazon.com/Berserk-Deluxe-1-Kentaro-Miura/dp/1506711987/ref=sr_1_6?qid=1636073928&s=books&sr=1-6,Comics & Graphic Novels,"Kentaro Miura, ",https://m.media-amazon.com/images/I/91vJgGrdcDL._AC_UY218_.jpg
"Marvel Encyclopedia, New Edition","amazing, second, limited, old, occupied, provocative, revealing, appropriate, fascinating, excellent,","Marvel Encyclopedia, New Edition amazing, second, limited, old, occupied, provocative, revealing, appropriate, fascinating, excellent,",https://www.amazon.com/Marvel-Encyclopedia-New-Stan-Lee/dp/1465478906/ref=sr_1_7?qid=1636073928&s=books&sr=1-7,Comics & Graphic Novels,"Stephen Wiacek, DK, ",https://m.media-amazon.com/images/I/A17DZrW3vvL._AC_UY218_.jpg
Attack on Titan 34,"eldian, normal, rough, smart, rumble, familiar, 1st, upset, peaceful, civil,","Attack on Titan 34 eldian, normal, rough, smart, rumble, familiar, 1st, upset, peaceful, civil,",https://www.amazon.com/Attack-Titan-34-Hajime-Isayama/dp/1646512367/ref=sr_1_9?qid=1636073928&s=books&sr=1-9,Comics & Graphic Novels,"Hajime Isayama, ",https://m.media-amazon.com/images/I/81Wlsq0zqvL._AC_UY218_.jpg
Dilbert 2022 Day-to-Day Calendar,"sollte,","Dilbert 2022 Day-to-Day Calendar sollte,",https://www.amazon.com/Dilbert-2022-Day-Day-Calendar/dp/1524863459/ref=sr_1_10?qid=1636073928&s=books&sr=1-10,Comics & Graphic Novels,"Scott Adams, ",https://m.media-amazon.com/images/I/714Dn6K5JTL._AC_UY218_.jpg
"The Drawing Book for Kids: 365 Daily Things to Draw, Step by Step (Woo! Jr. Kids Activities Books)","hard, different, little, ok, basic, bored, extra, current, previous, particular,","The Drawing Book for Kids: 365 Daily Things to Draw, Step by Step (Woo! Jr. Kids Activities Books) hard, different, little, ok, basic, bored, extra, current, previous, particular,",https://www.amazon.com/Drawing-Book-Kids-Things-Activities/dp/0997799374/ref=sr_1_11?qid=1636073928&s=books&sr=1-11,Comics & Graphic Novels,"Woo! Jr. Kids Activities, ",https://m.media-amazon.com/images/I/91ItoXSgQ1L._AC_UY218_.jpg
Death Note Complete Box Set: Volumes 1-13 with Premium,"14th, new, colorful, sure, dark, upset, actual, excited, late, extra,","Death Note Complete Box Set: Volumes 1-13 with Premium 14th, new, colorful, sure, dark, upset, actual, excited, late, extra,",https://www.amazon.com/Death-Note-Box-Vol-s-1-13/dp/142152581X/ref=sr_1_12?qid=1636073928&s=books&sr=1-12,Comics & Graphic Novels,"Tsugumi Ohba, ",https://m.media-amazon.com/images/I/61GDICORCHL._AC_UY218_.jpg
Akira 35th Anniversary Box Set,"true, free, high, awesome, tight, terrible, original, new, bad, normal,","Akira 35th Anniversary Box Set true, free, high, awesome, tight, terrible, original, new, bad, normal,",https://www.amazon.com/Akira-35th-Anniversary-Box-Set/dp/1632364611/ref=sr_1_13?qid=1636073928&s=books&sr=1-13,Comics & Graphic Novels,"Katsuhiro Otomo, ",https://m.media-amazon.com/images/I/A1YetY67WHL._AC_UY218_.jpg
Berserk Deluxe Volume 8,"amazing, fragile, different, glad, deluxe, incredible, terrible, oversized, disappointing, tight,","Berserk Deluxe Volume 8 amazing, fragile, different, glad, deluxe, incredible, terrible, oversized, disappointing, tight,",https://www.amazon.com/Berserk-Deluxe-8-Kentaro-Mira/dp/1506717918/ref=sr_1_15?qid=1636073928&s=books&sr=1-15,Comics & Graphic Novels,"Kentaro Mira, ",https://m.media-amazon.com/images/I/91CV8GppfYL._AC_UY218_.jpg
"Sapiens: A Graphic History, Volume 2: The Pillars of Civilization (Sapiens: A Graphic History, 2)","compatible, excellent, orederd, avid, long, swift, fast, related, native, available,","Sapiens: A Graphic History, Volume 2: The Pillars of Civilization (Sapiens: A Graphic History, 2) compatible, excellent, orederd, avid, long, swift, fast, related, native, available,",https://www.amazon.com/Sapiens-Graphic-History-Pillars-Civilization/dp/0063212234/ref=sr_1_16?qid=1636073928&s=books&sr=1-16,Comics & Graphic Novels,"Yuval Noah Harari, ",https://m.media-amazon.com/images/I/81wN3RhexHS._AC_UY218_.jpg
"The Pioneer Woman Cooks―Super Easy!: 120 Shortcut Recipes for Dinners, Desserts, and More","late, hot, everyday, digestive, great, wonderful, cool, social, instant, weird,","The Pioneer Woman Cooks―Super Easy!: 120 Shortcut Recipes for Dinners, Desserts, and More late, hot, everyday, digestive, great, wonderful, cool, social, instant, weird,",https://www.amazon.com/Pioneer-Woman-Cooks_Super-Easy-Shortcut/dp/0062962760/ref=sr_1_1?qid=1636074047&s=books&sr=1-1,"Cookbooks, Food & Wine","Ree Drummond, ",https://m.media-amazon.com/images/I/815lWq3j-tS._AC_UY218_.jpg
Taste: My Life Through Food,"delicious, italian, satisfying, unnecessary, gruesome, past, witty, bad,","Taste: My Life Through Food delicious, italian, satisfying, unnecessary, gruesome, past, witty, bad,",https://www.amazon.com/Taste-My-Life-Through-Food/dp/1982168013/ref=sr_1_2?qid=1636074047&s=books&sr=1-2,"Cookbooks, Food & Wine","Stanley Tucci, ",https://m.media-amazon.com/images/I/71xPLm2FenL._AC_UY218_.jpg
Cravings: All Together: Recipes to Love: A Cookbook,"classic, well, indulgent, previous, disappointed, beautiful, excited, asian, complex, quick,","Cravings: All Together: Recipes to Love: A Cookbook classic, well, indulgent, previous, disappointed, beautiful, excited, asian, complex, quick,",https://www.amazon.com/Cravings-Together-Recipes-Love-Cookbook/dp/0593135423/ref=sr_1_3?qid=1636074047&s=books&sr=1-3,"Cookbooks, Food & Wine","Chrissy Teigen, ",https://m.media-amazon.com/images/I/91YV+p6-f0L._AC_UY218_.jpg
Joshua Weissman: An Unapologetic Cookbook. #1 NEW YORK TIMES BESTSELLER,"perfect, big, good, fermented, hot, new, well, massive, possible, lazy,","Joshua Weissman: An Unapologetic Cookbook. #1 NEW YORK TIMES BESTSELLER perfect, big, good, fermented, hot, new, well, massive, possible, lazy,",https://www.amazon.com/Joshua-Weissman-Unapologetic-Cookbook/dp/1615649980/ref=sr_1_4?qid=1636074047&s=books&sr=1-4,"Cookbooks, Food & Wine","Joshua Weissman, ",https://m.media-amazon.com/images/I/91m4x8jBBzS._AC_UY218_.jpg
Beautiful Boards: 50 Amazing Snack Boards for Any Occasion,"informative, interesting, standard, small, beautiful, different, savory, certain, inspiring, appealing,","Beautiful Boards: 50 Amazing Snack Boards for Any Occasion informative, interesting, standard, small, beautiful, different, savory, certain, inspiring, appealing,",https://www.amazon.com/Beautiful-Boards-Amazing-Snack-Occasion/dp/1631066471/ref=sr_1_5?qid=1636074047&s=books&sr=1-5,"Cookbooks, Food & Wine","Maegan Brown, ",https://m.media-amazon.com/images/I/A1ZJztFsOvL._AC_UY218_.jpg
"Maid: Hard Work, Low Pay, and a Mother's Will to Survive","upper, middle, high, good, bad, real, basic, organic, single, terrible,","Maid: Hard Work, Low Pay, and a Mother's Will to Survive upper, middle, high, good, bad, real, basic, organic, single, terrible,",https://www.amazon.com/Maid-Hard-Work-Mothers-Survive/dp/0316505099/ref=sr_1_6?qid=1636074047&s=books&sr=1-6,"Cookbooks, Food & Wine","Stephanie Land, ",https://m.media-amazon.com/images/I/71GB-yyM8jL._AC_UY218_.jpg
Gastro Obscura: A Food Adventurer's Guide (Atlas Obscura),"unusual, beautiful, interesting, foodie, able, fabulous, wacky, ridiculous, disappointed, interested,","Gastro Obscura: A Food Adventurer's Guide (Atlas Obscura) unusual, beautiful, interesting, foodie, able, fabulous, wacky, ridiculous, disappointed, interested,",https://www.amazon.com/Gastro-Obscura-Adventurers-Guide-Atlas/dp/1523502193/ref=sr_1_7?qid=1636074047&s=books&sr=1-7,"Cookbooks, Food & Wine","Cecily Wong, Dylan Thuras, ",https://m.media-amazon.com/images/I/91a8I2CEO+L._AC_UY218_.jpg
The Korean Vegan Cookbook: Reflections and Recipes from Omma's Kitchen,"new, korean, able, impossible, disappointed, intact, bent, shabby,","The Korean Vegan Cookbook: Reflections and Recipes from Omma's Kitchen new, korean, able, impossible, disappointed, intact, bent, shabby,",https://www.amazon.com/Korean-Vegan-Cookbook-Reflections-Recipes/dp/0593084276/ref=sr_1_8?qid=1636074047&s=books&sr=1-8,"Cookbooks, Food & Wine","Joanne Lee Molinaro, ",https://m.media-amazon.com/images/I/81sphJyaRYL._AC_UY218_.jpg
"Cooking at Home: Or, How I Learned to Stop Worrying About Recipes (And Love My Microwave): A Cookbook","casual, disappointed, nice, new, flashy, small, experienced, difficult, white, narrow,","Cooking at Home: Or, How I Learned to Stop Worrying About Recipes (And Love My Microwave): A Cookbook casual, disappointed, nice, new, flashy, small, experienced, difficult, white, narrow,",https://www.amazon.com/Cooking-Home-Worrying-Microwave-Cookbook/dp/1524759244/ref=sr_1_9?qid=1636074047&s=books&sr=1-9,"Cookbooks, Food & Wine","Priya Krishna, David Chang, ",https://m.media-amazon.com/images/I/81jv-usV2rL._AC_UY218_.jpg
Air Fryer Cookbook: 600 Effortless Air Fryer Recipes for Beginners and Advanced Users,"numerous, successful, proof, incorrect, main, italian, true, misleading, logical, alphabetical,","Air Fryer Cookbook: 600 Effortless Air Fryer Recipes for Beginners and Advanced Users numerous, successful, proof, incorrect, main, italian, true, misleading, logical, alphabetical,",https://www.amazon.com/Air-Fryer-Cookbook-Effortless-Beginners/dp/1674844468/ref=sr_1_12?qid=1636074047&s=books&sr=1-12,"Cookbooks, Food & Wine","Jenson William, ",https://m.media-amazon.com/images/I/71me4qIaCAL._AC_UY218_.jpg
"Half Baked Harvest Super Simple: More Than 125 Recipes for Instant, Overnight, Meal-Prepped, and Easy Comfort Foods: A Cookbook","heavy, local, large, rich, vegetarian, aesthetic, bland, gorgeous, buttery, huge,","Half Baked Harvest Super Simple: More Than 125 Recipes for Instant, Overnight, Meal-Prepped, and Easy Comfort Foods: A Cookbook heavy, local, large, rich, vegetarian, aesthetic, bland, gorgeous, buttery, huge,",https://www.amazon.com/Half-Baked-Harvest-Super-Simple/dp/0525577076/ref=sr_1_13?qid=1636074047&s=books&sr=1-13,"Cookbooks, Food & Wine","Tieghan Gerard, ",https://m.media-amazon.com/images/I/71iFEI2yj4L._AC_UY218_.jpg
"From Crook to Cook: Platinum Recipes from Tha Boss Dogg's Kitchen (Snoop Dogg Cookbook, Celebrity Cookbook with Soul Food Recipes) (Snoop Dog x Chronicle Books)","fluff, anecdotal, new, upset, 3pg, disappointing, excited, disappointed, small, likely,","From Crook to Cook: Platinum Recipes from Tha Boss Dogg's Kitchen (Snoop Dogg Cookbook, Celebrity Cookbook with Soul Food Recipes) (Snoop Dog x Chronicle Books) fluff, anecdotal, new, upset, 3pg, disappointing, excited, disappointed, small, likely,",https://www.amazon.com/Crook-Cook-Platinum-Recipes-Kitchen/dp/1452179611/ref=sr_1_15?qid=1636074047&s=books&sr=1-15,"Cookbooks, Food & Wine","Snoop Dogg, ",https://m.media-amazon.com/images/I/91vD4ftg5XL._AC_UY218_.jpg
Immune: A Journey into the Mysterious System That Keeps You Alive,"great, thoughtful, interesting, bright, glossy, colorful, dull, old, regular, short,","Immune: A Journey into the Mysterious System That Keeps You Alive great, thoughtful, interesting, bright, glossy, colorful, dull, old, regular, short,",https://www.amazon.com/Immune-Journey-Mysterious-System-Keeps/dp/0593241312/ref=sr_1_2?qid=1636074194&s=books&sr=1-2,Science & Math,"Philipp Dettmer, ",https://m.media-amazon.com/images/I/81gbU+o1A5L._AC_UY218_.jpg
"The Body Keeps the Score: Brain, Mind, and Body in the Healing of Trauma","sexual, individual, vietnamese, clinical, central, interested, concerned, poor, real, psychological,","The Body Keeps the Score: Brain, Mind, and Body in the Healing of Trauma sexual, individual, vietnamese, clinical, central, interested, concerned, poor, real, psychological,",https://www.amazon.com/Body-Keeps-Score-Healing-Trauma/dp/0143127748/ref=sr_1_3?qid=1636074194&s=books&sr=1-3,Science & Math,"Bessel van der Kolk M.D., ",https://m.media-amazon.com/images/I/61NdJMwAThS._AC_UY218_.jpg
Plandemic: Fear Is the Virus. Truth Is the Cure.,"big,","Plandemic: Fear Is the Virus. Truth Is the Cure. big,",https://www.amazon.com/Plandemic-Fear-Virus-Truth-Cure/dp/1510765549/ref=sr_1_4?qid=1636074194&s=books&sr=1-4,Science & Math,"Mikki Willis, ",https://m.media-amazon.com/images/I/71MFYGSqImL._AC_UY218_.jpg
Sapiens: A Brief History of Humankind,"inter, subjective, important, physical, social, early, identical, mathematical, critical, wrong,","Sapiens: A Brief History of Humankind inter, subjective, important, physical, social, early, identical, mathematical, critical, wrong,",https://www.amazon.com/Sapiens-Humankind-Yuval-Noah-Harari/dp/0062316117/ref=sr_1_5?qid=1636074194&s=books&sr=1-5,Science & Math,"Yuval Harari, ",https://m.media-amazon.com/images/I/71N3-FFSDxL._AC_UY218_.jpg
The Book of Hope: A Survival Guide for Trying Times (Global Icons Series),"human, previous, constant, repetitive, boring, great, excited, hot, little, crazy,","The Book of Hope: A Survival Guide for Trying Times (Global Icons Series) human, previous, constant, repetitive, boring, great, excited, hot, little, crazy,",https://www.amazon.com/Book-Hope-Survival-Trying-Global/dp/1250784093/ref=sr_1_6?qid=1636074194&s=books&sr=1-6,Science & Math,"Jane Goodall, Douglas Abrams, ",https://m.media-amazon.com/images/I/810lYWL3EpS._AC_UY218_.jpg
Attached: The New Science of Adult Attachment and How It Can Help YouFind - and Keep - Love,"familiar, hopeful, abusive, unconscious, safe, important, intimate, anxious, non, problematic,","Attached: The New Science of Adult Attachment and How It Can Help YouFind - and Keep - Love familiar, hopeful, abusive, unconscious, safe, important, intimate, anxious, non, problematic,",https://www.amazon.com/Attached-Science-Adult-Attachment-YouFind/dp/1585429139/ref=sr_1_8?qid=1636074194&s=books&sr=1-8,Science & Math,"Amir Levine, ",https://m.media-amazon.com/images/I/71+hA-t71zL._AC_UY218_.jpg
Where the Deer and the Antelope Play: The Pastoral Observations of One Ignorant American Who Loves to Walk Outside,"liberal, global, social, crazy, emotional, negative, political, long, minded, positive,","Where the Deer and the Antelope Play: The Pastoral Observations of One Ignorant American Who Loves to Walk Outside liberal, global, social, crazy, emotional, negative, political, long, minded, positive,",https://www.amazon.com/Where-Deer-Antelope-Play-Observations/dp/1101984694/ref=sr_1_10?qid=1636074194&s=books&sr=1-10,Science & Math,"Nick Offerman, ",https://m.media-amazon.com/images/I/814i+bMiprL._AC_UY218_.jpg
Crystals for Beginners: The Guide to Get Started with the Healing Power of Crystals,"basic, good, misleading, inexperienced, dangerous, sure, surprised, wrong, entire, illegible,","Crystals for Beginners: The Guide to Get Started with the Healing Power of Crystals basic, good, misleading, inexperienced, dangerous, sure, surprised, wrong, entire, illegible,",https://www.amazon.com/Crystals-Beginners-Guide-Started-Healing/dp/1623159911/ref=sr_1_11?qid=1636074194&s=books&sr=1-11,Science & Math,"Karen Frazier, ",https://m.media-amazon.com/images/I/81CMKSCOz7L._AC_UY218_.jpg
COVID-19 and the Global Predators: We Are the Prey,"political, 78th, annual, medical, scientific, disappointed, strong, able,","COVID-19 and the Global Predators: We Are the Prey political, 78th, annual, medical, scientific, disappointed, strong, able,",https://www.amazon.com/COVID-19-Global-Predators-are-Prey/dp/0982456069/ref=sr_1_12?qid=1636074194&s=books&sr=1-12,Science & Math,"Peter Roger Breggin, ",https://m.media-amazon.com/images/I/611Ty2SxV6L._AC_UY218_.jpg
"Peak Mind: Find Your Focus, Own Your Attention, Invest 12 Minutes a Day","little, worth, total, helpful, coherent,","Peak Mind: Find Your Focus, Own Your Attention, Invest 12 Minutes a Day little, worth, total, helpful, coherent,",https://www.amazon.com/Peak-Mind-Attention-Invest-Minutes/dp/B08V5KFRM5/ref=sr_1_13?qid=1636074194&s=books&sr=1-13,Science & Math,"Amishi P. Jha, ",https://m.media-amazon.com/images/I/716nrtK5LPL._AC_UY218_.jpg
"The Truth About COVID-19: Exposing The Great Reset, Lockdowns, Vaccine Passports, and the New Normal","good, fine, lethal, long, large, clinical, detailed, successful, multi, dangerous,","The Truth About COVID-19: Exposing The Great Reset, Lockdowns, Vaccine Passports, and the New Normal good, fine, lethal, long, large, clinical, detailed, successful, multi, dangerous,",https://www.amazon.com/Truth-About-COVID-19-Lockdowns-Passports/dp/1645020886/ref=sr_1_14?qid=1636074194&s=books&sr=1-14,Science & Math,"Doctor Joseph Mercola, Ronnie Cummins, ",https://m.media-amazon.com/images/I/61UgmTGY6SL._AC_UY218_.jpg
"Braiding Sweetgrass: Indigenous Wisdom, Scientific Knowledge and the Teachings of Plants","obvious, interesting, true, strong, 1st, ecological, competent, important, great, traditional,","Braiding Sweetgrass: Indigenous Wisdom, Scientific Knowledge and the Teachings of Plants obvious, interesting, true, strong, 1st, ecological, competent, important, great, traditional,",https://www.amazon.com/Braiding-Sweetgrass-Indigenous-Scientific-Knowledge/dp/1571313567/ref=sr_1_15?qid=1636074194&s=books&sr=1-15,Science & Math,"Robin Wall Kimmerer, ",https://m.media-amazon.com/images/I/51-9XtnmQfS._AC_UY218_.jpg
Think Again: The Power of Knowing What You Don't Know,"interesting, appropriate, helpful, new, shallow, righteous, laden, trump, old, global,","Think Again: The Power of Knowing What You Don't Know interesting, appropriate, helpful, new, shallow, righteous, laden, trump, old, global,",https://www.amazon.com/Think-Again-Power-Knowing-What/dp/1984878107/ref=sr_1_16?qid=1636074194&s=books&sr=1-16,Science & Math,"Adam Grant, ",https://m.media-amazon.com/images/I/71tHmRxhU5S._AC_UY218_.jpg
