Title,Tag,Title_and_tag,Link,Category,Author,Image
"Badass Affirmations: The Wit and Wisdom of Wild Women (Inspirational Quotes for Women, Daily Affirmations Book)","powerful, famous, small, sure, short, simplistic, strong, average, appropriate, interested,","Badass Affirmations: The Wit and Wisdom of Wild Women (Inspirational Quotes for Women, Daily Affirmations Book) powerful, famous, small, sure, short, simplistic, strong, average, appropriate, interested,",https://www.amazon.com/Badass-Affirmations-Wisdom-Wild-Women/dp/1633537528/ref=sr_1_11?qid=1636075415&s=books&sr=1-11,LGBTQ+ Books,"Becca Anderson, ",https://m.media-amazon.com/images/I/61KCwfDNahL._AC_UY218_.jpg
The Sweetness of Water (Oprah's Book Club): A Novel,"brilliant, novel, authentic, hard, subject, compelling, satisfied, bad, african, american,","The Sweetness of Water (Oprah's Book Club): A Novel brilliant, novel, authentic, hard, subject, compelling, satisfied, bad, african, american,",https://www.amazon.com/Sweetness-Water-Oprahs-Book-Club/dp/0316362484/ref=sr_1_12?qid=1636075415&s=books&sr=1-12,LGBTQ+ Books,"Nathan Harris, ",https://m.media-amazon.com/images/I/91Cd4UUgrIL._AC_UY218_.jpg
Aristotle and Dante Discover the Secrets of the Universe,"annoying, boring, asleep, magical, straight, emotional, stagnant, lonely, tedious, interesting,","Aristotle and Dante Discover the Secrets of the Universe annoying, boring, asleep, magical, straight, emotional, stagnant, lonely, tedious, interesting,",https://www.amazon.com/Aristotle-Dante-Discover-Secrets-Universe/dp/1442408936/ref=sr_1_13?qid=1636075415&s=books&sr=1-13,LGBTQ+ Books,"Benjamin Alire Sáenz, ",https://m.media-amazon.com/images/I/81w9ZlovACL._AC_UY218_.jpg
The Perks of Being a Wallflower,"similar, normal, real, dear, upset, believable, literary, high, cool, young,","The Perks of Being a Wallflower similar, normal, real, dear, upset, believable, literary, high, cool, young,",https://www.amazon.com/Perks-Being-Wallflower-Stephen-Chbosky/dp/1451696191/ref=sr_1_15?qid=1636075415&s=books&sr=1-15,LGBTQ+ Books,"Stephen Chbosky, ",https://m.media-amazon.com/images/I/71LpyfcWWTL._AC_UY218_.jpg
Pillow Thoughts,"appropriate, broken, good, emotional, sweet, young, different, strong, certain, sure,","Pillow Thoughts appropriate, broken, good, emotional, sweet, young, different, strong, certain, sure,",https://www.amazon.com/Pillow-Thoughts-Courtney-Peppernell/dp/1449489753/ref=sr_1_16?qid=1636075415&s=books&sr=1-16,LGBTQ+ Books,"Courtney Peppernell, ",https://m.media-amazon.com/images/I/71bUf4gWhnL._AC_UY218_.jpg
It Ends with Us: A Novel,"good, mad, personal, red, male, typical, glad, handsome, beautiful, low,","It Ends with Us: A Novel good, mad, personal, red, male, typical, glad, handsome, beautiful, low,",https://www.amazon.com/Ends-Us-Novel-Colleen-Hoover/dp/1501110365/ref=sr_1_1?qid=1636075508&s=books&sr=1-1,Romance,"Colleen Hoover, ",https://m.media-amazon.com/images/I/71xUvuJiqgL._AC_UY218_.jpg
The Wish,"awful, good, main, old, depressing, medical, major, final, happy, close,","The Wish awful, good, main, old, depressing, medical, major, final, happy, close,",https://www.amazon.com/The-Wish/dp/B0944BZ5XX/ref=sr_1_3?qid=1636075508&s=books&sr=1-3,Romance,"Nicholas Sparks, ",https://m.media-amazon.com/images/I/81wPRktVjGL._AC_UY218_.jpg
The Seven Husbands of Evelyn Hugo: A Novel,"bisexual, meaningful, countless, late, interesting, average, boring, forth, fifth, main,","The Seven Husbands of Evelyn Hugo: A Novel bisexual, meaningful, countless, late, interesting, average, boring, forth, fifth, main,",https://www.amazon.com/Seven-Husbands-Evelyn-Hugo-Novel/dp/1501161938/ref=sr_1_4?qid=1636075508&s=books&sr=1-4,Romance,"Taylor Jenkins Reid, ",https://m.media-amazon.com/images/I/716Tlym5yRL._AC_UY218_.jpg
The Love Hypothesis,"awkward, surprised, decent, main, spicy, fake, excited, great, big, worth,","The Love Hypothesis awkward, surprised, decent, main, spicy, fake, excited, great, big, worth,",https://www.amazon.com/Love-Hypothesis-Ali-Hazelwood/dp/0593336828/ref=sr_1_5?qid=1636075508&s=books&sr=1-5,Romance,"Ali Hazelwood, ",https://m.media-amazon.com/images/I/41720Sh-chL._AC_UY218_.jpg
Ugly Love: A Novel,"mysterious, special, annoying, confusing, stupid, well, boring, casual, poetic, deep,","Ugly Love: A Novel mysterious, special, annoying, confusing, stupid, well, boring, casual, poetic, deep,",https://www.amazon.com/Ugly-Love-Novel-Colleen-Hoover/dp/1476753180/ref=sr_1_6?qid=1636075508&s=books&sr=1-6,Romance,"Colleen Hoover, ",https://m.media-amazon.com/images/I/617gMRW9DYL._AC_UY218_.jpg
Verity,"bad, handsome, dark, twisty, large, unbelievable, real, wrong, autobiographical, convoluted,","Verity bad, handsome, dark, twisty, large, unbelievable, real, wrong, autobiographical, convoluted,",https://www.amazon.com/Verity-Colleen-Hoover/dp/1791392792/ref=sr_1_8?qid=1636075508&s=books&sr=1-8,Romance,"Colleen Hoover, ",https://m.media-amazon.com/images/I/615IUDTbGDL._AC_UY218_.jpg
November 9: A Novel,"actual, little, tragic, crazy, well, emotional, bad, deep, good, wrong,","November 9: A Novel actual, little, tragic, crazy, well, emotional, bad, deep, good, wrong,",https://www.amazon.com/November-9-Novel-Colleen-Hoover/dp/1501110349/ref=sr_1_9?qid=1636075508&s=books&sr=1-9,Romance,"Colleen Hoover, ",https://m.media-amazon.com/images/I/819GdrzJz8L._AC_UY218_.jpg
Redeeming Love,"christian, emotional, abused, incredible, male, abusive, disturbing, physical, sexual, tragic,","Redeeming Love christian, emotional, abused, incredible, male, abusive, disturbing, physical, sexual, tragic,",https://www.amazon.com/Redeeming-Love-Francine-Rivers/dp/1590525132/ref=sr_1_10?qid=1636075508&s=books&sr=1-10,Romance,"Francine Rivers, ",https://m.media-amazon.com/images/I/81+g7gx6A-L._AC_UY218_.jpg
Punk 57,"cruel, real, dumb, enjoyable, true, good, bad, hard, well, similar,","Punk 57 cruel, real, dumb, enjoyable, true, good, bad, hard, well, similar,",https://www.amazon.com/Punk-57-Penelope-Douglas/dp/1539427765/ref=sr_1_11?qid=1636075508&s=books&sr=1-11,Romance,"Penelope Douglas, ",https://m.media-amazon.com/images/I/8191Oj7GMSL._AC_UY218_.jpg
People We Meet on Vacation,"awful, pet, nice, crazy, bad, audible, nonexistent, absolute, attractive, cute,","People We Meet on Vacation awful, pet, nice, crazy, bad, audible, nonexistent, absolute, attractive, cute,",https://www.amazon.com/People-Meet-Vacation-Emily-Henry/dp/1984806750/ref=sr_1_12?qid=1636075508&s=books&sr=1-12,Romance,"Emily Henry, ",https://m.media-amazon.com/images/I/813QkLg2LaL._AC_UY218_.jpg
A Shadow in the Ember (Flesh and Fire Book 1),"emotional, wise, annoying, similar, female, little, male, old, great, related,","A Shadow in the Ember (Flesh and Fire Book 1) emotional, wise, annoying, similar, female, little, male, old, great, related,",https://www.amazon.com/Shadow-Ember-Flesh-Fire-Book-ebook/dp/B08Z2ZJSR3/ref=sr_1_13?qid=1636075508&s=books&sr=1-13,Romance,"Jennifer L. Armentrout, ",https://m.media-amazon.com/images/I/91Qy9nZpb5S._AC_UY218_.jpg
Dear Santa: A Novel,"perfect, new, good, actual, unfold, kind, main, right, bad, lovely,","Dear Santa: A Novel perfect, new, good, actual, unfold, kind, main, right, bad, lovely,",https://www.amazon.com/Dear-Santa-Novel-Debbie-Macomber/dp/1984818813/ref=sr_1_14?qid=1636075508&s=books&sr=1-14,Romance,"Debbie Macomber, ",https://m.media-amazon.com/images/I/81MkKf-30EL._AC_UY218_.jpg
The Spanish Love Deception,"cold, american, dramatic, female, great, main, long, little, similar, spanish,","The Spanish Love Deception cold, american, dramatic, female, great, main, long, little, similar, spanish,",https://www.amazon.com/Spanish-Love-Deception-Elena-Armas/dp/B08X7RKXGK/ref=sr_1_15?qid=1636075508&s=books&sr=1-15,Romance,"Elena Armas, ",https://m.media-amazon.com/images/I/61NKofnTTyL._AC_UY218_.jpg
The Ex Hex,"rare, okay, cute, amazing, bored, extreme, emotional, single, identical, critical,","The Ex Hex rare, okay, cute, amazing, bored, extreme, emotional, single, identical, critical,",https://www.amazon.com/Ex-Hex-Novel-Erin-Sterling/dp/006302747X/ref=sr_1_16?qid=1636075508&s=books&sr=1-16,Romance,"Erin Sterling, ",https://m.media-amazon.com/images/I/61CQXhi824L._AC_UY218_.jpg
The 48 Laws of Power,"smart, old, hungry, different, white, narcissistic, high, good, bad, human,","The 48 Laws of Power smart, old, hungry, different, white, narcissistic, high, good, bad, human,",https://www.amazon.com/48-Laws-Power-Robert-Greene/dp/0140280197/ref=sr_1_1?qid=1636075614&qsid=146-2930825-2310558&s=books&sr=1-1&sres=0140280197%2C0358574315%2C0989081532%2C0525657746%2C0316551309%2C081298496X%2C0393531562%2C194564009X%2C0143118757%2C1541736699%2C1631494538%2C0767914171%2C0578666154%2C1524763136%2C0593196651%2C1565842715,Law,"Robert Greene, ",https://m.media-amazon.com/images/I/71951W96oWL._AC_UY218_.jpg
There Is Nothing for You Here: Finding Opportunity in the Twenty-First Century,"public, audible, sure, economic, 5th, long, small, detailed, fine, intelligent,","There Is Nothing for You Here: Finding Opportunity in the Twenty-First Century public, audible, sure, economic, 5th, long, small, detailed, fine, intelligent,",https://www.amazon.com/There-Nothing-You-Here-Twenty-First/dp/0358574315/ref=sr_1_2?qid=1636075614&qsid=146-2930825-2310558&s=books&sr=1-2&sres=0140280197%2C0358574315%2C0989081532%2C0525657746%2C0316551309%2C081298496X%2C0393531562%2C194564009X%2C0143118757%2C1541736699%2C1631494538%2C0767914171%2C0578666154%2C1524763136%2C0593196651%2C1565842715,Law,"Fiona Hill, ",https://m.media-amazon.com/images/I/81KxES3nvRS._AC_UY218_.jpg
The LSAT Trainer: A Remarkable Self-Study Guide For The Self-Driven Student,"hard, technical, open, logical, difficult, easy, certain, wrong, well, inconsistent,","The LSAT Trainer: A Remarkable Self-Study Guide For The Self-Driven Student hard, technical, open, logical, difficult, easy, certain, wrong, well, inconsistent,",https://www.amazon.com/LSAT-Trainer-Remarkable-Self-Study-Self-Driven/dp/0989081532/ref=sr_1_3?qid=1636075614&qsid=146-2930825-2310558&s=books&sr=1-3&sres=0140280197%2C0358574315%2C0989081532%2C0525657746%2C0316551309%2C081298496X%2C0393531562%2C194564009X%2C0143118757%2C1541736699%2C1631494538%2C0767914171%2C0578666154%2C1524763136%2C0593196651%2C1565842715,Law,"Mike Kim, ",https://m.media-amazon.com/images/I/61cc6p+agIL._AC_UY218_.jpg
Crying in H Mart: A Memoir,"interested, mental, snd, happy, specific, neglectful, casual, high, personal, favorite,","Crying in H Mart: A Memoir interested, mental, snd, happy, specific, neglectful, casual, high, personal, favorite,",https://www.amazon.com/Crying-H-Mart-Memoir/dp/B08FMVVQGF/ref=sr_1_4?qid=1636075614&qsid=146-2930825-2310558&s=books&sr=1-4&sres=0140280197%2C0358574315%2C0989081532%2C0525657746%2C0316551309%2C081298496X%2C0393531562%2C194564009X%2C0143118757%2C1541736699%2C1631494538%2C0767914171%2C0578666154%2C1524763136%2C0593196651%2C1565842715,Law,"Michelle Zauner, ",https://m.media-amazon.com/images/I/81gcQTXsBoL._AC_UY218_.jpg
"Dopesick: Dealers, Doctors, and the Drug Company that Addicted America","interested, incomplete, natural, revelatory, fellow, greedy, repetitious, confusing, boring, empathic,","Dopesick: Dealers, Doctors, and the Drug Company that Addicted America interested, incomplete, natural, revelatory, fellow, greedy, repetitious, confusing, boring, empathic,",https://www.amazon.com/Dopesick-Dealers-Doctors-Company-Addicted/dp/0316551309/ref=sr_1_5?qid=1636075614&qsid=146-2930825-2310558&s=books&sr=1-5&sres=0140280197%2C0358574315%2C0989081532%2C0525657746%2C0316551309%2C081298496X%2C0393531562%2C194564009X%2C0143118757%2C1541736699%2C1631494538%2C0767914171%2C0578666154%2C1524763136%2C0593196651%2C1565842715,Law,"Beth Macy, ",https://m.media-amazon.com/images/I/81f2zzwub+L._AC_UY218_.jpg
Just Mercy: A Story of Justice and Redemption,"corrupt, good, sad, horrible, ill, aware, tired, able, dead, prejudiced,","Just Mercy: A Story of Justice and Redemption corrupt, good, sad, horrible, ill, aware, tired, able, dead, prejudiced,",https://www.amazon.com/Just-Mercy-Story-Justice-Redemption/dp/081298496X/ref=sr_1_6?qid=1636075614&qsid=146-2930825-2310558&s=books&sr=1-6&sres=0140280197%2C0358574315%2C0989081532%2C0525657746%2C0316551309%2C081298496X%2C0393531562%2C194564009X%2C0143118757%2C1541736699%2C1631494538%2C0767914171%2C0578666154%2C1524763136%2C0593196651%2C1565842715,Law,"Bryan Stevenson, ",https://m.media-amazon.com/images/I/91eRIvymqRL._AC_UY218_.jpg
People Love Dead Jews: Reports from a Haunted Present,"dead, remarkable, jewish, insightful, chinese, provocative, great, sarcastic, caustic, revealing,","People Love Dead Jews: Reports from a Haunted Present dead, remarkable, jewish, insightful, chinese, provocative, great, sarcastic, caustic, revealing,",https://www.amazon.com/People-Love-Dead-Jews-Reports/dp/0393531562/ref=sr_1_7?qid=1636075614&qsid=146-2930825-2310558&s=books&sr=1-7&sres=0140280197%2C0358574315%2C0989081532%2C0525657746%2C0316551309%2C081298496X%2C0393531562%2C194564009X%2C0143118757%2C1541736699%2C1631494538%2C0767914171%2C0578666154%2C1524763136%2C0593196651%2C1565842715,Law,"Dara Horn, ",https://m.media-amazon.com/images/I/61KjYL7uFXS._AC_UY218_.jpg
Retirement Planning Guidebook: Navigating the Important Decisions for Retirement Success,"solid, present, useful, previous, apparent,","Retirement Planning Guidebook: Navigating the Important Decisions for Retirement Success solid, present, useful, previous, apparent,",https://www.amazon.com/Retirement-Planning-Guidebook-Navigating-Important/dp/194564009X/ref=sr_1_8?qid=1636075614&qsid=146-2930825-2310558&s=books&sr=1-8&sres=0140280197%2C0358574315%2C0989081532%2C0525657746%2C0316551309%2C081298496X%2C0393531562%2C194564009X%2C0143118757%2C1541736699%2C1631494538%2C0767914171%2C0578666154%2C1524763136%2C0593196651%2C1565842715,Law,"Wade Pfau, ",https://m.media-amazon.com/images/I/61hwcyoYTVL._AC_UY218_.jpg
Getting to Yes: Negotiating Agreement Without Giving In,"useful, adversarial, real, great, good, unconvinced, encompassing, non, personal, minor,","Getting to Yes: Negotiating Agreement Without Giving In useful, adversarial, real, great, good, unconvinced, encompassing, non, personal, minor,",https://www.amazon.com/Getting-Yes-Negotiating-Agreement-Without/dp/0143118757/ref=sr_1_9?qid=1636075614&qsid=146-2930825-2310558&s=books&sr=1-9&sres=0140280197%2C0358574315%2C0989081532%2C0525657746%2C0316551309%2C081298496X%2C0393531562%2C194564009X%2C0143118757%2C1541736699%2C1631494538%2C0767914171%2C0578666154%2C1524763136%2C0593196651%2C1565842715,Law,"Roger Fisher, ",https://m.media-amazon.com/images/I/61loIAdnWxL._AC_UY218_.jpg
"Robert's Rules of Order Newly Revised, 12th edition","subsequent, original, deluxe, plain, detailed, short, able, small, public, numerous,","Robert's Rules of Order Newly Revised, 12th edition subsequent, original, deluxe, plain, detailed, short, able, small, public, numerous,",https://www.amazon.com/Roberts-Rules-Order-Newly-Revised/dp/1541736699/ref=sr_1_10?qid=1636075614&qsid=146-2930825-2310558&s=books&sr=1-10&sres=0140280197%2C0358574315%2C0989081532%2C0525657746%2C0316551309%2C081298496X%2C0393531562%2C194564009X%2C0143118757%2C1541736699%2C1631494538%2C0767914171%2C0578666154%2C1524763136%2C0593196651%2C1565842715,Law,"Henry M. Robert III, ",https://m.media-amazon.com/images/I/71G+tMnSiiL._AC_UY218_.jpg
The Color of Law: A Forgotten History of How Our Government Segregated America,"personal, racist, prevalent, interesting, specific, systemic, non, new, honest, informative,","The Color of Law: A Forgotten History of How Our Government Segregated America personal, racist, prevalent, interesting, specific, systemic, non, new, honest, informative,",https://www.amazon.com/The-Color-of-Law-audiobook/dp/B0747SW5PF/ref=sr_1_11?qid=1636075614&qsid=146-2930825-2310558&s=books&sr=1-11&sres=0140280197%2C0358574315%2C0989081532%2C0525657746%2C0316551309%2C081298496X%2C0393531562%2C194564009X%2C0143118757%2C1541736699%2C1631494538%2C0767914171%2C0578666154%2C1524763136%2C0593196651%2C1565842715,Law,"Richard Rothstein, ",https://m.media-amazon.com/images/I/81rI8admBCL._AC_UY218_.jpg
"The Last Duel: A True Story of Crime, Scandal, and Trial by Combat","subsequent, controversial, boring, wrong, wide, filtered, real, nice, direct, primary,","The Last Duel: A True Story of Crime, Scandal, and Trial by Combat subsequent, controversial, boring, wrong, wide, filtered, real, nice, direct, primary,",https://www.amazon.com/Last-Duel-Scandal-Combat-Medieval/dp/0767914171/ref=sr_1_12?qid=1636075614&qsid=146-2930825-2310558&s=books&sr=1-12&sres=0140280197%2C0358574315%2C0989081532%2C0525657746%2C0316551309%2C081298496X%2C0393531562%2C194564009X%2C0143118757%2C1541736699%2C1631494538%2C0767914171%2C0578666154%2C1524763136%2C0593196651%2C1565842715,Law,"Eric Jager, ",https://m.media-amazon.com/images/I/81adM-6U3DL._AC_UY218_.jpg
The Bluebook: A Uniform System of Citation,"obvious, online, 20th, wrong, overpriced, mere, bent, thin, limited, nice,","The Bluebook: A Uniform System of Citation obvious, online, 20th, wrong, overpriced, mere, bent, thin, limited, nice,",https://www.amazon.com/Bluebook-Uniform-System-Citation-21st/dp/0578666154/ref=sr_1_13?qid=1636075614&qsid=146-2930825-2310558&s=books&sr=1-13&sres=0140280197%2C0358574315%2C0989081532%2C0525657746%2C0316551309%2C081298496X%2C0393531562%2C194564009X%2C0143118757%2C1541736699%2C1631494538%2C0767914171%2C0578666154%2C1524763136%2C0593196651%2C1565842715,Law,"Columbia Law Review, ",https://m.media-amazon.com/images/I/817CmbCqJEL._AC_UY218_.jpg
Becoming,"slow, shallow, minded, wrong, real, silly, good, congratulatory, predictable, great,","Becoming slow, shallow, minded, wrong, real, silly, good, congratulatory, predictable, great,",https://www.amazon.com/Becoming-Michelle-Obama-audiobook/dp/B07B3JQZCL/ref=sr_1_14?qid=1636075614&qsid=146-2930825-2310558&s=books&sr=1-14&sres=0140280197%2C0358574315%2C0989081532%2C0525657746%2C0316551309%2C081298496X%2C0393531562%2C194564009X%2C0143118757%2C1541736699%2C1631494538%2C0767914171%2C0578666154%2C1524763136%2C0593196651%2C1565842715,Law,"Michelle Obama, ",https://m.media-amazon.com/images/I/81bFNmhKrTL._AC_UY218_.jpg
"Love More, Fight Less: Communication Skills Every Couple Needs: A Relationship Workbook for Couples","great, hard, blank, standalone, significant, short, lacking, high, unhelpful, single,","Love More, Fight Less: Communication Skills Every Couple Needs: A Relationship Workbook for Couples great, hard, blank, standalone, significant, short, lacking, high, unhelpful, single,",https://www.amazon.com/Love-More-Fight-Less-Communication/dp/0593196651/ref=sr_1_15?qid=1636075614&qsid=146-2930825-2310558&s=books&sr=1-15&sres=0140280197%2C0358574315%2C0989081532%2C0525657746%2C0316551309%2C081298496X%2C0393531562%2C194564009X%2C0143118757%2C1541736699%2C1631494538%2C0767914171%2C0578666154%2C1524763136%2C0593196651%2C1565842715,Law,"Gina Senarighi PhD CPC, ",https://m.media-amazon.com/images/I/71PCCDMQDDL._AC_UY218_.jpg
Critical Race Theory: The Key Writings That Formed the Movement,"biblical, critical, christian, social, human, american, affirmative, hard, senseless, sad,","Critical Race Theory: The Key Writings That Formed the Movement biblical, critical, christian, social, human, american, affirmative, hard, senseless, sad,",https://www.amazon.com/Critical-Race-Theory-Writings-Movement/dp/1565842715/ref=sr_1_16?qid=1636075614&qsid=146-2930825-2310558&s=books&sr=1-16&sres=0140280197%2C0358574315%2C0989081532%2C0525657746%2C0316551309%2C081298496X%2C0393531562%2C194564009X%2C0143118757%2C1541736699%2C1631494538%2C0767914171%2C0578666154%2C1524763136%2C0593196651%2C1565842715,Law,"Kimberle Crenshaw, ",https://m.media-amazon.com/images/I/718pOuQ-lwL._AC_UY218_.jpg
Big Shot Diary of a Wimpy Kid Book 16,"entire, interested, entertaining, predictable, well, previous, funny, dull, redundant, excited,","Big Shot Diary of a Wimpy Kid Book 16 entire, interested, entertaining, predictable, well, previous, funny, dull, redundant, excited,",https://www.amazon.com/Big-Shot-Diary-Wimpy-Book/dp/1419749153/ref=sr_1_1?qid=1636075705&s=books&sr=1-1,Children's Books,"Jeff Kinney, ",https://m.media-amazon.com/images/I/81z6xJd6mrS._AC_UY218_.jpg
Paint by Sticker Kids: Christmas: Create 10 Pictures One Sticker at a Time! Includes Glitter Stickers,"detailed, small, old, easy, unusable, perfect, particular, inaccurate, hard, fine,","Paint by Sticker Kids: Christmas: Create 10 Pictures One Sticker at a Time! Includes Glitter Stickers detailed, small, old, easy, unusable, perfect, particular, inaccurate, hard, fine,",https://www.amazon.com/Paint-Sticker-Kids-Workman-Publishing/dp/152350675X/ref=sr_1_2?qid=1636075705&s=books&sr=1-2,Children's Books,"Workman Publishing, ",https://m.media-amazon.com/images/I/81GXl0dweAL._AC_UY218_.jpg
The Christmas Pig,"cold, broken, divorced, teenage, rebellious, appropriate, 4th, rich, scary, harsh,","The Christmas Pig cold, broken, divorced, teenage, rebellious, appropriate, 4th, rich, scary, harsh,",https://www.amazon.com/Christmas-Pig-J-K-Rowling/dp/1338790234/ref=sr_1_3?qid=1636075705&s=books&sr=1-3,Children's Books,"Jim Field, J. K. Rowling, ",https://m.media-amazon.com/images/I/71bROORU+nL._AC_UY218_.jpg
Harry Potter Paperback Box Set (Books 1-7),"new, nice, azkaban, second, legal, detrimental, coarse, industrial, blurred, young,","Harry Potter Paperback Box Set (Books 1-7) new, nice, azkaban, second, legal, detrimental, coarse, industrial, blurred, young,",https://www.amazon.com/Harry-Potter-Paperback-Box-Books/dp/0545162076/ref=sr_1_4?qid=1636075705&s=books&sr=1-4,Children's Books,"J. K. Rowling, ",https://m.media-amazon.com/images/I/71fNalmuvbL._AC_UY218_.jpg
Harry Potter and the Chamber of Secrets (MinaLima Edition) (Illustrated edition) (2),"excited, good,","Harry Potter and the Chamber of Secrets (MinaLima Edition) (Illustrated edition) (2) excited, good,",https://www.amazon.com/Potter-Chamber-Secrets-MinaLima-Illustrated/dp/1338716530/ref=sr_1_5?qid=1636075705&s=books&sr=1-5,Children's Books,"Minalima, J. K. Rowling, ",https://m.media-amazon.com/images/I/71rCcl7ZEKL._AC_UY218_.jpg
How to Catch a Turkey,"old, leprechaun, ok, creative, fun, little, angry, young, cute, grand,","How to Catch a Turkey old, leprechaun, ok, creative, fun, little, angry, young, cute, grand,",https://www.amazon.com/How-Catch-Turkey-Adam-Wallace/dp/1492664359/ref=sr_1_6?qid=1636075705&s=books&sr=1-6,Children's Books,"Adam Wallace, Andy Elkerton, ",https://m.media-amazon.com/images/I/91DEviT3oUL._AC_UY218_.jpg
My First Library : Boxset of 10 Board Books for Kids,"odd, easy, green, english, inaccurate, heavy, satisfied, bad, square, non,","My First Library : Boxset of 10 Board Books for Kids odd, easy, green, english, inaccurate, heavy, satisfied, bad, square, non,",https://www.amazon.com/My-First-Library-Boxset-Board/dp/9387779262/ref=sr_1_7?qid=1636075705&s=books&sr=1-7,Children's Books,"Wonder House Books, ",https://m.media-amazon.com/images/I/71xBLRBYOiL._AC_UY218_.jpg
Little Blue Truck's Halloween,"awesome, total, good, blue, open, disappointed, sweet, meaningful, great, familiar,","Little Blue Truck's Halloween awesome, total, good, blue, open, disappointed, sweet, meaningful, great, familiar,",https://www.amazon.com/Little-Trucks-Halloween-Alice-Schertle/dp/0544772539/ref=sr_1_8?qid=1636075705&s=books&sr=1-8,Children's Books,"Alice Schertle, Jill McElmurry, ",https://m.media-amazon.com/images/I/51MB5SD5GIL._AC_UY218_.jpg
The Very Hungry Caterpillar,"dull, dirty, young, sure, old, great, disappointed, complete, famous, opaque,","The Very Hungry Caterpillar dull, dirty, young, sure, old, great, disappointed, complete, famous, opaque,",https://www.amazon.com/Very-Hungry-Caterpillar-Eric-Carle/dp/0399226907/ref=sr_1_9?qid=1636075705&s=books&sr=1-9,Children's Books,"Eric Carle, ",https://m.media-amazon.com/images/I/71KilybDOoL._AC_UY218_.jpg
If Animals Kissed Good Night,"strange, appropriate, cute, weird, traditional, little, uncomfortable, different, odd, eligible,","If Animals Kissed Good Night strange, appropriate, cute, weird, traditional, little, uncomfortable, different, odd, eligible,",https://www.amazon.com/If-Animals-Kissed-Good-Night/dp/0374300216/ref=sr_1_10?qid=1636075705&s=books&sr=1-10,Children's Books,"Ann Whitford Paul, ",https://m.media-amazon.com/images/I/81nzxODnaJL._AC_UY218_.jpg
"World of Eric Carle, Hear Bear Roar 30-Button Animal Sound Book - Great for First Words - PI Kids","unfathomable, disappointing, disturbing, poor, great, able, total, available, cool, previous,","World of Eric Carle, Hear Bear Roar 30-Button Animal Sound Book - Great for First Words - PI Kids unfathomable, disappointing, disturbing, poor, great, able, total, available, cool, previous,",https://www.amazon.com/World-Carle-Animal-Sound-sound/dp/1450874770/ref=sr_1_11?qid=1636075705&s=books&sr=1-11,Children's Books,"Eric Carle, Editors of Phoenix International Publications, ",https://m.media-amazon.com/images/I/91qWG6zFVIL._AC_UY218_.jpg
Dog Man: The Supa Epic Collection: From the Creator of Captain Underpants (Dog Man #1-6 Box Set),"comic, easy, fifth, small, cute, scatological, simpo, damaged, weird, old,","Dog Man: The Supa Epic Collection: From the Creator of Captain Underpants (Dog Man #1-6 Box Set) comic, easy, fifth, small, cute, scatological, simpo, damaged, weird, old,",https://www.amazon.com/Dog-Man-Collection-Creator-Underpants/dp/1338603345/ref=sr_1_13?qid=1636075705&s=books&sr=1-13,Children's Books,"Dav Pilkey, ",https://m.media-amazon.com/images/I/718nyuJLWYL._AC_UY218_.jpg
