Title,Tag,Title_and_tag,Link,Category,Author,Image
The Art of Mixology: Classic Cocktails and Curious Concoctions,"unusual, fresh, covid, beautiful, good, legit, large, ridiculous, tiny, essential,","The Art of Mixology: Classic Cocktails and Curious Concoctions unusual, fresh, covid, beautiful, good, legit, large, ridiculous, tiny, essential,",https://www.amazon.com/Art-Mixology-Classic-Cocktails-Concoctions/dp/1680524100/ref=sr_1_18?qid=1639357009&s=books&sr=1-18,"Cookbooks, Food & Wine","Parragon Books, ",https://m.media-amazon.com/images/I/91BaXFsLeSL._AC_UY218_.jpg
The Ultimate Final Fantasy XIV Cookbook: The Essential Culinarian Guide to Hydaelyn,"attached, large, disappointed, uncommon, standard, asian, great, sorry, nice, bland,","The Ultimate Final Fantasy XIV Cookbook: The Essential Culinarian Guide to Hydaelyn attached, large, disappointed, uncommon, standard, asian, great, sorry, nice, bland,",https://www.amazon.com/Ultimate-Final-Fantasy-XIV-Cookbook/dp/1647225116/ref=sr_1_19?qid=1639357009&s=books&sr=1-19,"Cookbooks, Food & Wine","Victoria Rosenthal, ",https://m.media-amazon.com/images/I/81zskCD50QL._AC_UY218_.jpg
The Korean Vegan Cookbook: Reflections and Recipes from Omma's Kitchen,"white, metric, asian, proud, special, ancestral, cringeworthy, evident, brown, good,","The Korean Vegan Cookbook: Reflections and Recipes from Omma's Kitchen white, metric, asian, proud, special, ancestral, cringeworthy, evident, brown, good,",https://www.amazon.com/Korean-Vegan-Cookbook-Reflections-Recipes/dp/0593084276/ref=sr_1_20?qid=1639357009&s=books&sr=1-20,"Cookbooks, Food & Wine","Joanne Lee Molinaro, ",https://m.media-amazon.com/images/I/81XEhFQdMVL._AC_UY218_.jpg
Heroes' Feast (Dungeons & Dragons): The Official D&D Cookbook,"modern, final, big, sweet, new, worth, mundane, hard, themed, main,","Heroes' Feast (Dungeons & Dragons): The Official D&D Cookbook modern, final, big, sweet, new, worth, mundane, hard, themed, main,",https://www.amazon.com/Heroes-Feast-Official-Dungeons-Cookbook/dp/1984858904/ref=sr_1_21?qid=1639357009&s=books&sr=1-21,"Cookbooks, Food & Wine","Jon Peterson, Kyle Newman, ",https://m.media-amazon.com/images/I/91BtVZAwD+L._AC_UY218_.jpg
Dessert Person: Recipes and Guidance for Baking with Confidence,"extra, raw, center, sure, small, good, visual, delicious, important, multiple,","Dessert Person: Recipes and Guidance for Baking with Confidence extra, raw, center, sure, small, good, visual, delicious, important, multiple,",https://www.amazon.com/Dessert-Person-Recipes-Guidance-Confidence/dp/1984826964/ref=sr_1_22?qid=1639357009&s=books&sr=1-22,"Cookbooks, Food & Wine","Claire Saffitz, ",https://m.media-amazon.com/images/I/A1hbGRwYVlL._AC_UY218_.jpg
The Blue Zones Kitchen: 100 Recipes to Live to 100,"unhealthy, pretty, typical, aware, blue, major, vegetarian, original, nice, sure,","The Blue Zones Kitchen: 100 Recipes to Live to 100 unhealthy, pretty, typical, aware, blue, major, vegetarian, original, nice, sure,",https://www.amazon.com/Blue-Zones-Kitchen-Recipes-Live/dp/1426220138/ref=sr_1_23?qid=1639357009&s=books&sr=1-23,"Cookbooks, Food & Wine","Dan Buettner, ",https://m.media-amazon.com/images/I/7171RHnoLTL._AC_UY218_.jpg
The How-To Cookbook for Teens: 100 Easy Recipes to Learn the Basics,"simple, raw, complicated, fried, honest, vague, elementary, devoid, single, proper,","The How-To Cookbook for Teens: 100 Easy Recipes to Learn the Basics simple, raw, complicated, fried, honest, vague, elementary, devoid, single, proper,",https://www.amazon.com/How-Cookbook-Teens-Recipes-Basics/dp/1646114191/ref=sr_1_24?qid=1639357009&s=books&sr=1-24,"Cookbooks, Food & Wine","Julee Morrison, ",https://m.media-amazon.com/images/I/91BSDlmDH7L._AC_UY218_.jpg
The Essential New York Times Cookbook: The Recipes of Record,"wonderful, fantastic, wet, sure, big, excited, dirty, greasy, 2nd, cheap,","The Essential New York Times Cookbook: The Recipes of Record wonderful, fantastic, wet, sure, big, excited, dirty, greasy, 2nd, cheap,",https://www.amazon.com/Essential-New-York-Times-Cookbook/dp/1324002271/ref=sr_1_25?qid=1639357009&s=books&sr=1-25,"Cookbooks, Food & Wine","Amanda Hesser, ",https://m.media-amazon.com/images/I/51hW+d9yS+S._AC_UY218_.jpg
The Step-by-Step Instant Pot Cookbook: 100 Simple Recipes for Spectacular Results -- with Photographs of Every Step,"busy, simple, new, natural, extra, little, future, fair, multiple, wonderful,","The Step-by-Step Instant Pot Cookbook: 100 Simple Recipes for Spectacular Results -- with Photographs of Every Step busy, simple, new, natural, extra, little, future, fair, multiple, wonderful,",https://www.amazon.com/Step-Step-Instant-Pot-Cookbook/dp/0316460834/ref=sr_1_26?qid=1639357009&s=books&sr=1-26,"Cookbooks, Food & Wine","Jeffrey Eisner, ",https://m.media-amazon.com/images/I/81OvhgznaUS._AC_UY218_.jpg
"100 Cookies: The Baking Book for Every Kitchen, with Classic Cookies, Novel Treats, Brownies, Bars, and More","basic, uncoated, sweet, dull, important, specific, positive, flat, shiny, bummed,","100 Cookies: The Baking Book for Every Kitchen, with Classic Cookies, Novel Treats, Brownies, Bars, and More basic, uncoated, sweet, dull, important, specific, positive, flat, shiny, bummed,",https://www.amazon.com/100-Cookies-Kitchen-Classic-Brownies/dp/1452180733/ref=sr_1_27?qid=1639357009&s=books&sr=1-27,"Cookbooks, Food & Wine","Sarah Kieffer, ",https://m.media-amazon.com/images/I/91dZR+FXG4L._AC_UY218_.jpg
50 Ways to Eat Cock: Healthy Chicken Recipes with Balls!,"bland, embarrassing, good, black, white, actual, average, american, scottish, britty,","50 Ways to Eat Cock: Healthy Chicken Recipes with Balls! bland, embarrassing, good, black, white, actual, average, american, scottish, britty,",https://www.amazon.com/50-Ways-Eat-Cock-AlternaTips/dp/148259143X/ref=sr_1_28?qid=1639357009&s=books&sr=1-28,"Cookbooks, Food & Wine","Adrienne N Hew CN, ",https://m.media-amazon.com/images/I/71QqyLj02IL._AC_UY218_.jpg
"The Complete Air Fryer Cookbook: Amazingly Easy Recipes to Fry, Bake, Grill, and Roast with Your Air Fryer","frozen, fried, deep, remote, basic, steamed, bad, roasted, normal, challenging,","The Complete Air Fryer Cookbook: Amazingly Easy Recipes to Fry, Bake, Grill, and Roast with Your Air Fryer frozen, fried, deep, remote, basic, steamed, bad, roasted, normal, challenging,",https://www.amazon.com/Complete-Air-Fryer-Cookbook-Amazingly/dp/1623157439/ref=sr_1_29?qid=1639357009&s=books&sr=1-29,"Cookbooks, Food & Wine","Linda Larsen, ",https://m.media-amazon.com/images/I/91TSl1DT2QL._AC_UY218_.jpg
World Travel: An Irreverent Guide,"dry, long, old, outdated, scant, closed, short, breezy, fleeting, stark,","World Travel: An Irreverent Guide dry, long, old, outdated, scant, closed, short, breezy, fleeting, stark,",https://www.amazon.com/World-Travel-Irreverent-Anthony-Bourdain/dp/0062802798/ref=sr_1_31?qid=1639357009&s=books&sr=1-31,"Cookbooks, Food & Wine","Laurie Woolever, Anthony Bourdain, ",https://m.media-amazon.com/images/I/91vF8dQLyaS._AC_UY218_.jpg
Cravings: All Together: Recipes to Love: A Cookbook,"hard, weird, classic, indulgent, beautiful, excited, asian, quick, picky, interested,","Cravings: All Together: Recipes to Love: A Cookbook hard, weird, classic, indulgent, beautiful, excited, asian, quick, picky, interested,",https://www.amazon.com/Cravings-Together-Recipes-Love-Cookbook/dp/0593135423/ref=sr_1_32?qid=1639357009&s=books&sr=1-32,"Cookbooks, Food & Wine","Chrissy Teigen, ",https://m.media-amazon.com/images/I/91kvJRe+66L._AC_UY218_.jpg
Where the Deer and the Antelope Play: The Pastoral Observations of One Ignorant American Who Loves to Walk Outside,"funny, social, great, crazy, emotional, negative, political, minded, positive, inspirational,","Where the Deer and the Antelope Play: The Pastoral Observations of One Ignorant American Who Loves to Walk Outside funny, social, great, crazy, emotional, negative, political, minded, positive, inspirational,",https://www.amazon.com/Where-Deer-Antelope-Play-Observations/dp/1101984694/ref=sr_1_17?qid=1639357108&s=books&sr=1-17,Science & Math,"Nick Offerman, ",https://m.media-amazon.com/images/I/A1HG-57PUwL._AC_UY218_.jpg
Subpar Parks: America's Most Extraordinary National Parks and Their Least Impressed Visitors,"gray, real, entire, rough, witty, short, opposing, typical, useful, funny,","Subpar Parks: America's Most Extraordinary National Parks and Their Least Impressed Visitors gray, real, entire, rough, witty, short, opposing, typical, useful, funny,",https://www.amazon.com/Subpar-Parks-Americas-Extraordinary-Impressed/dp/0593185544/ref=sr_1_18?qid=1639357108&s=books&sr=1-18,Science & Math,"Amber Share, ",https://m.media-amazon.com/images/I/81RIp9usVfL._AC_UY218_.jpg
The Untethered Soul: The Journey Beyond Yourself,"wrong, open, applicable, mild, shallow, different, close, happy, disorganized, fundamental,","The Untethered Soul: The Journey Beyond Yourself wrong, open, applicable, mild, shallow, different, close, happy, disorganized, fundamental,",https://www.amazon.com/Untethered-Soul-Journey-Beyond-Yourself/dp/1572245379/ref=sr_1_19?qid=1639357108&s=books&sr=1-19,Science & Math,"Michael A. Singer, ",https://m.media-amazon.com/images/I/71-379ETO1L._AC_UY218_.jpg
Attached: The New Science of Adult Attachment and How It Can Help YouFind - and Keep - Love,"familiar, hopeful, intimate, non, unconscious, safe, abusive, important, anxious, problematic,","Attached: The New Science of Adult Attachment and How It Can Help YouFind - and Keep - Love familiar, hopeful, intimate, non, unconscious, safe, abusive, important, anxious, problematic,",https://www.amazon.com/Attached-Science-Adult-Attachment-YouFind/dp/1585429139/ref=sr_1_20?qid=1639357108&s=books&sr=1-20,Science & Math,"Amir Levine, ",https://m.media-amazon.com/images/I/71xNjwfeuyL._AC_UY218_.jpg
"Relaxing Flowers: Coloring Book For Adults With Flower Patterns, Bouquets, Wreaths, Swirls, Decorations.","nice, actual, cheap, little,","Relaxing Flowers: Coloring Book For Adults With Flower Patterns, Bouquets, Wreaths, Swirls, Decorations. nice, actual, cheap, little,",https://www.amazon.com/Relaxing-Flowers-Coloring-Patterns-Decorations/dp/B08NS7PGY1/ref=sr_1_22?qid=1639357108&s=books&sr=1-22,Science & Math,"Coloring Book Kim, ",https://m.media-amazon.com/images/I/710RwU35qWL._AC_UY218_.jpg
"What It's Like to Be a Bird: From Flying to Nesting, Eating to Singing--What Birds Are Doing, and Why (Sibley Guides)","pretty, vague, single, unwanted, fantastic, red, black, interesting, little, cognitive,","What It's Like to Be a Bird: From Flying to Nesting, Eating to Singing--What Birds Are Doing, and Why (Sibley Guides) pretty, vague, single, unwanted, fantastic, red, black, interesting, little, cognitive,",https://www.amazon.com/What-Its-Like-Bird-Singing-What/dp/0307957896/ref=sr_1_23?qid=1639357108&s=books&sr=1-23,Science & Math,"David Allen Sibley, ",https://m.media-amazon.com/images/I/81+8+W-0r7L._AC_UY218_.jpg
Baby University Board Book Set: A Science for Toddlers Board Book Set (Science Gifts for Kids) (Baby University Board Book Sets),"well, great, hard, interested, smart, complex, basic, colorful, goodnight, newtonian,","Baby University Board Book Set: A Science for Toddlers Board Book Set (Science Gifts for Kids) (Baby University Board Book Sets) well, great, hard, interested, smart, complex, basic, colorful, goodnight, newtonian,",https://www.amazon.com/Baby-University-Four-Book-Chris-Ferrie/dp/149267043X/ref=sr_1_24?qid=1639357108&s=books&sr=1-24,Science & Math,"Chris Ferrie, ",https://m.media-amazon.com/images/I/81ToF78jVVL._AC_UY218_.jpg
What If?: Serious Scientific Answers to Absurd Hypothetical Questions,"interesting, smart, sound, informative, short, enjoyable, stupid, interested, scientific, nice,","What If?: Serious Scientific Answers to Absurd Hypothetical Questions interesting, smart, sound, informative, short, enjoyable, stupid, interested, scientific, nice,",https://www.amazon.com/What-If-Scientific-Hypothetical-Questions/dp/0544272994/ref=sr_1_25?qid=1639357108&s=books&sr=1-25,Science & Math,"Randall Munroe, ",https://m.media-amazon.com/images/I/71Npl4I-gOL._AC_UY218_.jpg
Awesome Kitchen Science Experiments for Kids: 50 STEAM Projects You Can Eat! (Awesome STEAM Activities for Kids),"young, disappointing, boring, old, good, edible, intensive, complex, necessary, complimentary,","Awesome Kitchen Science Experiments for Kids: 50 STEAM Projects You Can Eat! (Awesome STEAM Activities for Kids) young, disappointing, boring, old, good, edible, intensive, complex, necessary, complimentary,",https://www.amazon.com/Awesome-Kitchen-Science-Experiments-Kids/dp/1641526211/ref=sr_1_26?qid=1639357108&s=books&sr=1-26,Science & Math,"Megan Olivia Hall, ",https://m.media-amazon.com/images/I/91YaoBC5UxL._AC_UY218_.jpg
Would You Rather? Made You Think! Edition: Answer Hilarious Questions and Win the Game of Wits (A Laugh and Think Book),"conversational, good, strange, interesting, elicit, intergenerational, gross, hard, pre, select,","Would You Rather? Made You Think! Edition: Answer Hilarious Questions and Win the Game of Wits (A Laugh and Think Book) conversational, good, strange, interesting, elicit, intergenerational, gross, hard, pre, select,",https://www.amazon.com/Would-You-Rather-Made-Think/dp/0593196791/ref=sr_1_27?qid=1639357108&s=books&sr=1-27,Science & Math,"Lindsey Daly, ",https://m.media-amazon.com/images/I/81oBLbJooTL._AC_UY218_.jpg
"Thinking, Fast and Slow","audio, common, little, angry, hard, tedious, interactive, non, dark, wrong,","Thinking, Fast and Slow audio, common, little, angry, hard, tedious, interactive, non, dark, wrong,",https://www.amazon.com/Thinking-Fast-Slow-Daniel-Kahneman/dp/0374533555/ref=sr_1_29?qid=1639357108&s=books&sr=1-29,Science & Math,"Daniel Kahneman, ",https://m.media-amazon.com/images/I/61fdrEuPJwL._AC_UY218_.jpg
"The Truth About COVID-19: Exposing The Great Reset, Lockdowns, Vaccine Passports, and the New Normal","good, fine, lethal, long, large, clinical, detailed, successful, multi, dangerous,","The Truth About COVID-19: Exposing The Great Reset, Lockdowns, Vaccine Passports, and the New Normal good, fine, lethal, long, large, clinical, detailed, successful, multi, dangerous,",https://www.amazon.com/Truth-About-COVID-19-Lockdowns-Passports/dp/1645020886/ref=sr_1_30?qid=1639357108&s=books&sr=1-30,Science & Math,"Doctor Joseph Mercola, Ronnie Cummins, ",https://m.media-amazon.com/images/I/61UgmTGY6SL._AC_UY218_.jpg
Paint by Sticker: Dogs: Create 12 Stunning Images One Sticker at a Time!,"bent, old, torn, stiff, rigid, average, okay, worth, cool, complicated,","Paint by Sticker: Dogs: Create 12 Stunning Images One Sticker at a Time! bent, old, torn, stiff, rigid, average, okay, worth, cool, complicated,",https://www.amazon.com/Paint-Sticker-Dogs-Workman-Publishing/dp/1523509651/ref=sr_1_31?qid=1639357108&s=books&sr=1-31,Science & Math,"Workman Publishing, ",https://m.media-amazon.com/images/I/811qGcQLC9L._AC_UY218_.jpg
Adult Coloring Book : 60 Stress Relieving Animals Designs: A Lot of Relaxing and Beautiful Scenes for Adults or Kids,"inconsistent, thick, good, certain, white, toothy, handed, comfortable, beautiful, disappointed,","Adult Coloring Book : 60 Stress Relieving Animals Designs: A Lot of Relaxing and Beautiful Scenes for Adults or Kids inconsistent, thick, good, certain, white, toothy, handed, comfortable, beautiful, disappointed,",https://www.amazon.com/Adult-Coloring-Book-Relieving-Beautiful/dp/B08LR8QRGG/ref=sr_1_32?qid=1639357108&s=books&sr=1-32,Science & Math,"Olympia Soares, ",https://m.media-amazon.com/images/I/71K3tyPzOeL._AC_UY218_.jpg
Princess Naomi Helps a Unicorn: A Dance-It-Out Creative Movement Story for Young Movers (Dance-It-Out! Creative Movement Stories for Young Movers),"fun, tiny, great, grand,","Princess Naomi Helps a Unicorn: A Dance-It-Out Creative Movement Story for Young Movers (Dance-It-Out! Creative Movement Stories for Young Movers) fun, tiny, great, grand,",https://www.amazon.com/Princess-Naomi-Helps-Unicorn-Dance/dp/173658992X/ref=sr_1_17?qid=1639357216&s=books&sr=1-17,"Health, Fitness & Dieting","Once Upon a Dance, ",https://m.media-amazon.com/images/I/61aAto9fl6L._AC_UY218_.jpg
The Book of Hope: A Survival Guide for Trying Times (Global Icons Series),"scientific, objective, great, previous, repetitive, boring, excited, hot, crazy, political,","The Book of Hope: A Survival Guide for Trying Times (Global Icons Series) scientific, objective, great, previous, repetitive, boring, excited, hot, crazy, political,",https://www.amazon.com/Book-Hope-Survival-Trying-Global/dp/1250784093/ref=sr_1_18?qid=1639357216&s=books&sr=1-18,"Health, Fitness & Dieting","Jane Goodall, ",https://m.media-amazon.com/images/I/81yPC1ukIaL._AC_UY218_.jpg
The Crystal Bible (The Crystal Bible Series),"definitive, unorganized, big, specific, basic, scientific, real, historical, dear, thie,","The Crystal Bible (The Crystal Bible Series) definitive, unorganized, big, specific, basic, scientific, real, historical, dear, thie,",https://www.amazon.com/Crystal-Bible-Judy-Hall/dp/1582972400/ref=sr_1_19?qid=1639357216&s=books&sr=1-19,"Health, Fitness & Dieting","Judy Hall, ",https://m.media-amazon.com/images/I/71xnybWKFgL._AC_UY218_.jpg
Good Days Start With Gratitude: A 52 Week Guide To Cultivate An Attitude Of Gratitude: Gratitude Journal,"small, random, greasy, thankful, upsetting, annoying, inspirational, shaped, blank, good,","Good Days Start With Gratitude: A 52 Week Guide To Cultivate An Attitude Of Gratitude: Gratitude Journal small, random, greasy, thankful, upsetting, annoying, inspirational, shaped, blank, good,",https://www.amazon.com/Good-Days-Start-Gratitude-Cultivate/dp/1976436184/ref=sr_1_20?qid=1639357216&s=books&sr=1-20,"Health, Fitness & Dieting","Pretty Simple Press, ",https://m.media-amazon.com/images/I/51VkB7O0v4L._AC_UY218_.jpg
Knee Ability Zero,"expensive, wrong, nice, easy, rentable, great,","Knee Ability Zero expensive, wrong, nice, easy, rentable, great,",https://www.amazon.com/Knee-Ability-Zero-Ben-Patrick/dp/B09KNGDYGL/ref=sr_1_21?qid=1639357216&s=books&sr=1-21,"Health, Fitness & Dieting","Ben Patrick, ",https://m.media-amazon.com/images/I/616KRdrlvNL._AC_UY218_.jpg
Dare to Lead: Brave Work. Tough Conversations. Whole Hearts.,"personal, different, direct, new, marxist, western, useless, decent, previous, applicable,","Dare to Lead: Brave Work. Tough Conversations. Whole Hearts. personal, different, direct, new, marxist, western, useless, decent, previous, applicable,",https://www.amazon.com/Dare-Lead-Brave-Conversations-Hearts/dp/0399592520/ref=sr_1_22?qid=1639357216&s=books&sr=1-22,"Health, Fitness & Dieting","Brené Brown, ",https://m.media-amazon.com/images/I/71Yz0igLjoL._AC_UY218_.jpg
Man's Search for Meaning,"horrible, well, bigoted, unimaginable, repetitive, sad, happy, weak, strong, pessimistic,","Man's Search for Meaning horrible, well, bigoted, unimaginable, repetitive, sad, happy, weak, strong, pessimistic,",https://www.amazon.com/Mans-Search-Meaning-Viktor-Frankl/dp/0807014273/ref=sr_1_23?qid=1639357216&s=books&sr=1-23,"Health, Fitness & Dieting","Viktor E. Frankl, ",https://m.media-amazon.com/images/I/81QtGH9r1lL._AC_UY218_.jpg
Beyond Order: 12 More Rules for Life,"young, literary, brilliant, national, bad, gay, legal, healthy, erudite, grateful,","Beyond Order: 12 More Rules for Life young, literary, brilliant, national, bad, gay, legal, healthy, erudite, grateful,",https://www.amazon.com/Beyond-Order-More-Rules-Life/dp/0593084640/ref=sr_1_24?qid=1639357216&s=books&sr=1-24,"Health, Fitness & Dieting","Jordan B. Peterson, ",https://m.media-amazon.com/images/I/91pzijVfAML._AC_UY218_.jpg
Badass Affirmations: The Wit and Wisdom of Wild Women (Gift idea for women),"powerful, famous, small, sure, short, simplistic, strong, average, appropriate, interested,","Badass Affirmations: The Wit and Wisdom of Wild Women (Gift idea for women) powerful, famous, small, sure, short, simplistic, strong, average, appropriate, interested,",https://www.amazon.com/Badass-Affirmations-Wisdom-Wild-Women/dp/1633537528/ref=sr_1_25?qid=1639357216&s=books&sr=1-25,"Health, Fitness & Dieting","Becca Anderson, ",https://m.media-amazon.com/images/I/61bIx1-VWRL._AC_UY218_.jpg
The Untethered Soul: The Journey Beyond Yourself,"wrong, open, applicable, mild, shallow, different, close, happy, disorganized, fundamental,","The Untethered Soul: The Journey Beyond Yourself wrong, open, applicable, mild, shallow, different, close, happy, disorganized, fundamental,",https://www.amazon.com/Untethered-Soul-Journey-Beyond-Yourself/dp/1572245379/ref=sr_1_26?qid=1639357216&s=books&sr=1-26,"Health, Fitness & Dieting","Michael A. Singer, ",https://m.media-amazon.com/images/I/71-379ETO1L._AC_UY218_.jpg
Attached: The New Science of Adult Attachment and How It Can Help YouFind - and Keep - Love,"familiar, hopeful, intimate, non, unconscious, safe, abusive, important, anxious, problematic,","Attached: The New Science of Adult Attachment and How It Can Help YouFind - and Keep - Love familiar, hopeful, intimate, non, unconscious, safe, abusive, important, anxious, problematic,",https://www.amazon.com/Attached-Science-Adult-Attachment-YouFind/dp/1585429139/ref=sr_1_27?qid=1639357216&s=books&sr=1-27,"Health, Fitness & Dieting","Amir Levine, ",https://m.media-amazon.com/images/I/71xNjwfeuyL._AC_UY218_.jpg
Chakra Healing: A Beginner's Guide to Self-Healing Techniques that Balance the Chakras,"new, spiritual, specific, useful, different, free, good, educational, insightful, wrong,","Chakra Healing: A Beginner's Guide to Self-Healing Techniques that Balance the Chakras new, spiritual, specific, useful, different, free, good, educational, insightful, wrong,",https://www.amazon.com/Chakra-Healing-Beginners-Self-Healing-Techniques/dp/1623158281/ref=sr_1_28?qid=1639357216&s=books&sr=1-28,"Health, Fitness & Dieting","Margarita Alcantara, ",https://m.media-amazon.com/images/I/71T6DpapwWL._AC_UY218_.jpg
Grandmother's Journal: Memories and Keepsakes for My Grandchild,"well, confusing, sure, new, worth, inconsistent, weird, certain, consistent, original,","Grandmother's Journal: Memories and Keepsakes for My Grandchild well, confusing, sure, new, worth, inconsistent, weird, certain, consistent, original,",https://www.amazon.com/Grandmothers-Journal-Memories-Keepsakes-Grandchild/dp/1681881780/ref=sr_1_29?qid=1639357216&s=books&sr=1-29,"Health, Fitness & Dieting","Blue Streak, ",https://m.media-amazon.com/images/I/81dcf9nmUrL._AC_UY218_.jpg
The One-Minute Gratitude Journal,"disappointed, regular, spiral, favorite, thin, small, helpful, good, terrible, steep,","The One-Minute Gratitude Journal disappointed, regular, spiral, favorite, thin, small, helpful, good, terrible, steep,",https://www.amazon.com/One-Minute-Gratitude-Journal-Brenda-Nathan/dp/1523242701/ref=sr_1_30?qid=1639357216&s=books&sr=1-30,"Health, Fitness & Dieting","Brenda Nathan, ",https://m.media-amazon.com/images/I/716wxEjNs-L._AC_UY218_.jpg
"Stop Overthinking: 23 Techniques to Relieve Stress, Stop Negative Spirals, Declutter Your Mind, and Focus on the Present (Mental and Emotional Abundance)","terrible, open, new, common, disappointed, basic, effective, entire, painful, disappointing,","Stop Overthinking: 23 Techniques to Relieve Stress, Stop Negative Spirals, Declutter Your Mind, and Focus on the Present (Mental and Emotional Abundance) terrible, open, new, common, disappointed, basic, effective, entire, painful, disappointing,",https://www.amazon.com/Stop-Overthinking-Techniques-Declutter-Emotional/dp/B08XLLF3PG/ref=sr_1_32?qid=1639357216&s=books&sr=1-32,"Health, Fitness & Dieting","Nick Trenton, ",https://m.media-amazon.com/images/I/71sk+qmIRqL._AC_UY218_.jpg
"A Little SPOT of Emotion 8 Book Box Set (Books 1-8: Anger, Anxiety, Peaceful, Happiness, Sadness, Confidence, Love, & Scribble Emotion)","old, proud, little, bored, confident, overall, great, helpful, white, willing,","A Little SPOT of Emotion 8 Book Box Set (Books 1-8: Anger, Anxiety, Peaceful, Happiness, Sadness, Confidence, Love, & Scribble Emotion) old, proud, little, bored, confident, overall, great, helpful, white, willing,",https://www.amazon.com/Little-SPOT-Emotion-Box-Books/dp/1951287134/ref=sr_1_17?qid=1639357337&s=books&sr=1-17,Education & Teaching,"Diane Alber, ",https://m.media-amazon.com/images/I/81Au8TxYNzL._AC_UY218_.jpg
"Princeton Review SAT Premium Prep, 2022: 9 Practice Tests + Review & Techniques + Online Tools (2021) (College Test Preparation)","actual, official, basic, tear, extra, nice, downloadable, well, good,","Princeton Review SAT Premium Prep, 2022: 9 Practice Tests + Review & Techniques + Online Tools (2021) (College Test Preparation) actual, official, basic, tear, extra, nice, downloadable, well, good,",https://www.amazon.com/Princeton-Review-Premium-Prep-2022/dp/0525570446/ref=sr_1_18?qid=1639357337&s=books&sr=1-18,Education & Teaching,"The Princeton Review, ",https://m.media-amazon.com/images/I/91LoPsA9ddL._AC_UY218_.jpg
The Total Money Makeover: Classic Edition: A Proven Plan for Financial Fitness,"successful, fake, sound, small, major, useless, low, financial, personal, actual,","The Total Money Makeover: Classic Edition: A Proven Plan for Financial Fitness successful, fake, sound, small, major, useless, low, financial, personal, actual,",https://www.amazon.com/Total-Money-Makeover-Classic-Financial/dp/1595555277/ref=sr_1_19?qid=1639357337&s=books&sr=1-19,Education & Teaching,"Dave Ramsey, ",https://m.media-amazon.com/images/I/51+L4aSe+gL._AC_UY218_.jpg
