Title,Title_and_tag,Tag,Link,Category,Author,Image
I Love You to the Moon and Back,"I Love You to the Moon and Back bad, open, favorite, tho, poor, little, understandable, bent, cute, damaged,","bad, open, favorite, tho, poor, little, understandable, bent, cute, damaged,",https://www.amazon.com/I-Love-You-Moon-Back/dp/1589255518/ref=sr_1_14?qid=1636075705&s=books&sr=1-14,Children's Books,"Amelia Hepworth, ",https://m.media-amazon.com/images/I/81eB+7+CkUL._AC_UY218_.jpg
Percy Jackson and the Olympians 5 Book Paperback Boxed Set (new covers w/poster) (Percy Jackson & the Olympians),"Percy Jackson and the Olympians 5 Book Paperback Boxed Set (new covers w/poster) (Percy Jackson & the Olympians) giant, clean, rough, able, mythological, different, nice, good, old, imaginable,","giant, clean, rough, able, mythological, different, nice, good, old, imaginable,",https://www.amazon.com/Jackson-Olympians-Paperback-covers-poster/dp/1484707230/ref=sr_1_15?qid=1636075705&s=books&sr=1-15,Children's Books,"Rick Riordan, ",https://m.media-amazon.com/images/I/81x1ZJ1IkoS._AC_UY218_.jpg
"My First Learn to Write Workbook: Practice for Kids with Pen Control, Line Tracing, Letters, and More!","My First Learn to Write Workbook: Practice for Kids with Pen Control, Line Tracing, Letters, and More! blue, interested, good, old, entire, perfect, simple, wrong, single, disappointed,","blue, interested, good, old, entire, perfect, simple, wrong, single, disappointed,",https://www.amazon.com/My-First-Learn-Write-Workbook/dp/1641526270/ref=sr_1_16?qid=1636075705&s=books&sr=1-16,Children's Books,"Crystal Radke, ",https://m.media-amazon.com/images/I/81Ekpv7AwKL._AC_UY218_.jpg
The Book of Hope: A Survival Guide for Trying Times (Global Icons Series),"The Book of Hope: A Survival Guide for Trying Times (Global Icons Series) scientific, objective, great, previous, repetitive, boring, excited, hot, crazy, political,","scientific, objective, great, previous, repetitive, boring, excited, hot, crazy, political,",https://www.amazon.com/Book-Hope-Survival-Trying-Global/dp/1250784093/ref=sr_1_17?qid=1639355508&s=books&sr=1-17,Biographies,"Jane Goodall, ",https://m.media-amazon.com/images/I/81yPC1ukIaL._AC_UY218_.jpg
The 5 Love Languages: The Secret to Love that Lasts,"The 5 Love Languages: The Secret to Love that Lasts sexual, few, weekly, happy, general, emotional, abusive, physical, straight, outdated,","sexual, few, weekly, happy, general, emotional, abusive, physical, straight, outdated,",https://www.amazon.com/Love-Languages-Secret-that-Lasts/dp/080241270X/ref=sr_1_18?qid=1639355508&s=books&sr=1-18,Biographies,"Gary Chapman, ",https://m.media-amazon.com/images/I/81RuAzKrHkL._AC_UY218_.jpg
The Crystal Bible (The Crystal Bible Series),"The Crystal Bible (The Crystal Bible Series) definitive, unorganized, big, specific, basic, scientific, real, historical, dear, fluorite,","definitive, unorganized, big, specific, basic, scientific, real, historical, dear, fluorite,",https://www.amazon.com/Crystal-Bible-Judy-Hall/dp/1582972400/ref=sr_1_19?qid=1639355508&s=books&sr=1-19,Biographies,"Judy Hall, ",https://m.media-amazon.com/images/I/71xnybWKFgL._AC_UY218_.jpg
"To Rescue the Republic: Ulysses S. Grant, the Fragile Union, and the Crisis of 1876","To Rescue the Republic: Ulysses S. Grant, the Fragile Union, and the Crisis of 1876 military, american, unnecessary, personal, political, absurd, late, nineteenth, real, woke,","military, american, unnecessary, personal, political, absurd, late, nineteenth, real, woke,",https://www.amazon.com/Rescue-Republic-Ulysses-Fragile-Crisis/dp/0063039540/ref=sr_1_20?qid=1639355508&s=books&sr=1-20,Biographies,"Bret Baier, ",https://m.media-amazon.com/images/I/81u8pA8kNEL._AC_UY218_.jpg
The Boys: A Memoir of Hollywood and Family,"The Boys: A Memoir of Hollywood and Family big, vulgar, famous, interesting, good, interested, entire, worth, pink, bad,","big, vulgar, famous, interesting, good, interested, entire, worth, pink, bad,",https://www.amazon.com/Boys-Memoir-Hollywood-Family/dp/006306524X/ref=sr_1_21?qid=1639355508&s=books&sr=1-21,Biographies,"Ron Howard, ",https://m.media-amazon.com/images/I/91uW0MrQtwL._AC_UY218_.jpg
Peril,"Peril real, factual, great, big, half, complete, liberal, silly, casual, different,","real, factual, great, big, half, complete, liberal, silly, casual, different,",https://www.amazon.com/Peril-Bob-Woodward/dp/1982182911/ref=sr_1_22?qid=1639355508&s=books&sr=1-22,Biographies,"Bob Woodward, ",https://m.media-amazon.com/images/I/71gk+H+yEkL._AC_UY218_.jpg
Greenlights,"Greenlights close, big, shallow, laughable, green, complete, total, shocking, amusing, convinced,","close, big, shallow, laughable, green, complete, total, shocking, amusing, convinced,",https://www.amazon.com/Greenlights/dp/B08HLW2JXD/ref=sr_1_23?qid=1639355508&s=books&sr=1-23,Biographies,"Matthew McConaughey, ",https://m.media-amazon.com/images/I/81PNeyIYVfL._AC_UY218_.jpg
Empire of Pain: The Secret History of the Sackler Dynasty,"Empire of Pain: The Secret History of the Sackler Dynasty work, able, numerous, sure, soft, real, large, opioid, bad, 1st,","work, able, numerous, sure, soft, real, large, opioid, bad, 1st,",https://www.amazon.com/Empire-Pain-History-Sackler-Dynasty/dp/0385545681/ref=sr_1_24?qid=1639355508&s=books&sr=1-24,Biographies,"Patrick Radden Keefe, ",https://m.media-amazon.com/images/I/71ToorJRl+L._AC_UY218_.jpg
The Baseball 100,"The Baseball 100 professional, great, clever, able, deliberate, gimmicky, authoritative, nice, subjective, smiley,","professional, great, clever, able, deliberate, gimmicky, authoritative, nice, subjective, smiley,",https://www.amazon.com/Baseball-100-Joe-Posnanski/dp/1982180587/ref=sr_1_25?qid=1639355508&s=books&sr=1-25,Biographies,"Joe Posnanski, ",https://m.media-amazon.com/images/I/51dXcz2K8bL._AC_UY218_.jpg
Extreme Ownership: How U.S. Navy SEALs Lead and Win,"Extreme Ownership: How U.S. Navy SEALs Lead and Win unique, elementary, large, recent, excited, modern, excellent, helpful, crazy, low,","unique, elementary, large, recent, excited, modern, excellent, helpful, crazy, low,",https://www.amazon.com/Extreme-Ownership-audiobook/dp/B015TM0RM4/ref=sr_1_26?qid=1639355508&s=books&sr=1-26,Biographies,"Jocko Willink, ",https://m.media-amazon.com/images/I/81zCJh6xsQL._AC_UY218_.jpg
Vanderbilt: The Rise and Fall of an American Dynasty,"Vanderbilt: The Rise and Fall of an American Dynasty gilded, fascinating, personal, previous, second, numerous, gay, old, informative, helpful,","gilded, fascinating, personal, previous, second, numerous, gay, old, informative, helpful,",https://www.amazon.com/Vanderbilt-Rise-Fall-American-Dynasty/dp/0062964615/ref=sr_1_27?qid=1639355508&s=books&sr=1-27,Biographies,"Katherine Howe, Anderson Cooper, ",https://m.media-amazon.com/images/I/81ur4nwZdBL._AC_UY218_.jpg
The Mamba Mentality: How I Play,"The Mamba Mentality: How I Play old, little, great, bad, interested, 5th, terrible, worried, past, 3rd,","old, little, great, bad, interested, 5th, terrible, worried, past, 3rd,",https://www.amazon.com/Mamba-Mentality-How-Play/dp/0374201234/ref=sr_1_28?qid=1639355508&s=books&sr=1-28,Biographies,"Kobe Bryant, ",https://m.media-amazon.com/images/I/A1z7ywkr2wL._AC_UY218_.jpg
World Travel: An Irreverent Guide,"World Travel: An Irreverent Guide dry, long, old, outdated, scant, short, breezy, fleeting, stark, present,","dry, long, old, outdated, scant, short, breezy, fleeting, stark, present,",https://www.amazon.com/World-Travel-Irreverent-Anthony-Bourdain/dp/0062802798/ref=sr_1_29?qid=1639355508&s=books&sr=1-29,Biographies,"Anthony Bourdain, Laurie Woolever, ",https://m.media-amazon.com/images/I/91vF8dQLyaS._AC_UY218_.jpg
Going There,"Going There real, young, smart, unflattering, interested, famous, public, accomplished, clear, savvy,","real, young, smart, unflattering, interested, famous, public, accomplished, clear, savvy,",https://www.amazon.com/Audible-Going-There/dp/B094RGFVWX/ref=sr_1_30?qid=1639355508&s=books&sr=1-30,Biographies,"Katie Couric, ",https://m.media-amazon.com/images/I/71zcTLgOIbL._AC_UY218_.jpg
The Chief’s Chief,"The Chief’s Chief different, entire, holy, pathetic, independent, bad, total, final, major, republican,","different, entire, holy, pathetic, independent, bad, total, final, major, republican,",https://www.amazon.com/Chiefs-Chief-Mark-Meadows/dp/1737478528/ref=sr_1_32?qid=1639355508&s=books&sr=1-32,Biographies,"Mark Meadows, ",https://m.media-amazon.com/images/I/61v4w-EPDwL._AC_UY218_.jpg
Wish You Were Here: A Novel,"Wish You Were Here: A Novel multiple, recent, right, pro, extreme, complicated, human, previous, main, covid,","multiple, recent, right, pro, extreme, complicated, human, previous, main, covid,",https://www.amazon.com/Wish-You-Were-Here-Novel/dp/1984818414/ref=sr_1_17?qid=1639355610&s=books&sr=1-17,Literature & Fiction,"Jodi Picoult, ",https://m.media-amazon.com/images/I/71QaoIm7HFL._AC_UY218_.jpg
Project Hail Mary,"Project Hail Mary new, wrong, centripetal, universal, amazing, incredible, suicidal, independent, proportional, average,","new, wrong, centripetal, universal, amazing, incredible, suicidal, independent, proportional, average,",https://www.amazon.com/Project-Hail-Mary/dp/B08GB58KD5/ref=sr_1_18?qid=1639355610&s=books&sr=1-18,Literature & Fiction,"Andy Weir, ",https://m.media-amazon.com/images/I/91vS2L5YfEL._AC_UY218_.jpg
"The Night Before Christmas Hardcover: The Classic Edition, The New York Times Bestseller (Christmas Book)","The Night Before Christmas Hardcover: The Classic Edition, The New York Times Bestseller (Christmas Book) heavy, great, soft, free, friendly, extra, fellow, chinese, nuclear, triple,","heavy, great, soft, free, friendly, extra, fellow, chinese, nuclear, triple,",https://www.amazon.com/Night-Before-Christmas-Charles-Santore/dp/1604332379/ref=sr_1_19?qid=1639355610&s=books&sr=1-19,Literature & Fiction,"Clement Moore, ",https://m.media-amazon.com/images/I/81cQLz6LpsL._AC_UY218_.jpg
State of Terror: A Novel,"State of Terror: A Novel good, political, confusing, fictional, left, russian, bad, multiple, excellent, worth,","good, political, confusing, fictional, left, russian, bad, multiple, excellent, worth,",https://www.amazon.com/State-Terror-Novel-Louise-Penny/dp/198217367X/ref=sr_1_20?qid=1639355610&s=books&sr=1-20,Literature & Fiction,"Louise Penny, Hillary Rodham Clinton, ",https://m.media-amazon.com/images/I/71ogguMNzHS._AC_UY218_.jpg
Fear No Evil (Alex Cross Book 29),"Fear No Evil (Alex Cross Book 29) rugged, personal, main, short, huge, favorite, bad, bizarre, old, slow,","rugged, personal, main, short, huge, favorite, bad, bizarre, old, slow,",https://www.amazon.com/Fear-Evil-Alex-Cross-Book-ebook/dp/B08Y8M2Y7T/ref=sr_1_21?qid=1639355610&s=books&sr=1-21,Literature & Fiction,"James Patterson, ",https://m.media-amazon.com/images/I/818fuqD06PL._AC_UY218_.jpg
The Song of Achilles: A Novel,"The Song of Achilles: A Novel great, mythological, poor, interested, gay, fun, worth, bucolic, unexplained, intense,","great, mythological, poor, interested, gay, fun, worth, bucolic, unexplained, intense,",https://www.amazon.com/Song-Achilles-Novel-Madeline-Miller/dp/0062060627/ref=sr_1_22?qid=1639355610&s=books&sr=1-22,Literature & Fiction,"Madeline Miller, ",https://m.media-amazon.com/images/I/81msb6gUBTL._AC_UY218_.jpg
"Dr. Seuss's Beginner Book Collection (Cat in the Hat, One Fish Two Fish, Green Eggs and Ham, Hop on Pop, Fox in Socks)","Dr. Seuss's Beginner Book Collection (Cat in the Hat, One Fish Two Fish, Green Eggs and Ham, Hop on Pop, Fox in Socks) well, good, sized, easy, wrong, displeased, damaged, young, duplicate, big,","well, good, sized, easy, wrong, displeased, damaged, young, duplicate, big,",https://www.amazon.com/Seusss-Beginner-Collection-Green-Socks/dp/0375851569/ref=sr_1_23?qid=1639355610&s=books&sr=1-23,Literature & Fiction,"Dr. Seuss, ",https://m.media-amazon.com/images/I/81FxtWFGiiL._AC_UY218_.jpg
Strixhaven: Curriculum of Chaos (D&D/MTG Adventure Book) (Dungeons & Dragons),"Strixhaven: Curriculum of Chaos (D&D/MTG Adventure Book) (Dungeons & Dragons) magical, new, decent, general, little, baseline, divine, nonreligious, normal, good,","magical, new, decent, general, little, baseline, divine, nonreligious, normal, good,",https://www.amazon.com/Strixhaven-Curriculum-Adventure-Dungeons-Dragons/dp/0786967447/ref=sr_1_24?qid=1639355610&s=books&sr=1-24,Literature & Fiction,"Wizards RPG Team, ",https://m.media-amazon.com/images/I/91HQFCH+gxL._AC_UY218_.jpg
Ugly Love: A Novel,"Ugly Love: A Novel mysterious, special, annoying, confusing, stupid, well, boring, casual, poetic, deep,","mysterious, special, annoying, confusing, stupid, well, boring, casual, poetic, deep,",https://www.amazon.com/Ugly-Love-Novel-Colleen-Hoover/dp/1476753180/ref=sr_1_25?qid=1639355610&s=books&sr=1-25,Literature & Fiction,"Colleen Hoover, ",https://m.media-amazon.com/images/I/617gMRW9DYL._AC_UY218_.jpg
"Dungeons & Dragons Core Rulebooks Gift Set (Special Foil Covers Edition with Slipcase, Player's Handbook, Dungeon Master's Guide, Monster Manual, DM Screen)","Dungeons & Dragons Core Rulebooks Gift Set (Special Foil Covers Edition with Slipcase, Player's Handbook, Dungeon Master's Guide, Monster Manual, DM Screen) extra, old, specific, big, disappointed, nice, standard, cool, perfect, likely,","extra, old, specific, big, disappointed, nice, standard, cool, perfect, likely,",https://www.amazon.com/Dungeons-Dragons-Rulebooks-Slipcase-Handbook/dp/0786966629/ref=sr_1_26?qid=1639355610&s=books&sr=1-26,Literature & Fiction,"Wizards RPG Team, ",https://m.media-amazon.com/images/I/71BURLYgGhL._AC_UY218_.jpg
Billy Summers,"Billy Summers big, tired, recent, wrong, fantastic, decent, mediocre, painful, dear, sad,","big, tired, recent, wrong, fantastic, decent, mediocre, painful, dear, sad,",https://www.amazon.com/Billy-Summers-Stephen-King/dp/1982173610/ref=sr_1_27?qid=1639355610&s=books&sr=1-27,Literature & Fiction,"Stephen King, ",https://m.media-amazon.com/images/I/81KQ2z4C-OL._AC_UY218_.jpg
The Dark Hours,"The Dark Hours left, old, wing, poor, bad, average, excellent, contemporary, pretty, fine,","left, old, wing, poor, bad, average, excellent, contemporary, pretty, fine,",https://www.amazon.com/Dark-Hours-Michael-Connelly-ebook/dp/B08WLRG1L2/ref=sr_1_28?qid=1639355610&s=books&sr=1-28,Literature & Fiction,"Michael Connelly, ",https://m.media-amazon.com/images/I/711nROt8jDS._AC_UY218_.jpg
The Four Winds: A Novel,"The Four Winds: A Novel communistic, sure, amazing, happy, new, political, tiny, small, dear, pro,","communistic, sure, amazing, happy, new, political, tiny, small, dear, pro,",https://www.amazon.com/Four-Winds-Novel-Kristin-Hannah-ebook/dp/B087ZXSPGJ/ref=sr_1_29?qid=1639355610&s=books&sr=1-29,Literature & Fiction,"Kristin Hannah, ",https://m.media-amazon.com/images/I/91+CnxqOEQS._AC_UY218_.jpg
Amelia Bedelia Chapter Book 4-Book Box Set: Books 1-4,"Amelia Bedelia Chapter Book 4-Book Box Set: Books 1-4 silly, obvious, original, disappointed, uninspired, derivative, jealous, embarrassed, adolescent, patriarchal,","silly, obvious, original, disappointed, uninspired, derivative, jealous, embarrassed, adolescent, patriarchal,",https://www.amazon.com/Amelia-Bedelia-Chapter-Book-Box/dp/0062334204/ref=sr_1_30?qid=1639355610&s=books&sr=1-30,Literature & Fiction,"Herman Parish, ",https://m.media-amazon.com/images/I/91E42BUiZKL._AC_UY218_.jpg
J.R.R. Tolkien 4-Book Boxed Set: The Hobbit and The Lord of the Rings,"J.R.R. Tolkien 4-Book Boxed Set: The Hobbit and The Lord of the Rings tall, true, small, nice, different, upset, beautiful, 11yr, confident, little,","tall, true, small, nice, different, upset, beautiful, 11yr, confident, little,",https://www.amazon.com/J-R-R-Tolkien-4-Book-Boxed-Set/dp/0345538374/ref=sr_1_31?qid=1639355610&s=books&sr=1-31,Literature & Fiction,"J.R.R. Tolkien, ",https://m.media-amazon.com/images/I/A1H-C8THP8L._AC_UY218_.jpg
Apples Never Fall,"Apples Never Fall toxic, new, skilled, domestic, literary, hard, ok, complicated, good, bad,","toxic, new, skilled, domestic, literary, hard, ok, complicated, good, bad,",https://www.amazon.com/Apples-Never-Fall/dp/B08V8939WY/ref=sr_1_32?qid=1639355610&s=books&sr=1-32,Literature & Fiction,"Liane Moriarty, ",https://m.media-amazon.com/images/I/81ZV+TzlboL._AC_UY218_.jpg
Sapiens: A Brief History of Humankind,"Sapiens: A Brief History of Humankind inter, subjective, important, physical, social, sensationalist, early, identical, mathematical, critical,","inter, subjective, important, physical, social, sensationalist, early, identical, mathematical, critical,",https://www.amazon.com/Sapiens-Humankind-Yuval-Noah-Harari/dp/0062316117/ref=sr_1_17?qid=1639355705&s=books&sr=1-17,History,"Yuval Harari, ",https://m.media-amazon.com/images/I/71N3-FFSDxL._AC_UY218_.jpg
The Chief’s Chief,"The Chief’s Chief different, entire, holy, pathetic, independent, bad, total, final, major, republican,","different, entire, holy, pathetic, independent, bad, total, final, major, republican,",https://www.amazon.com/Chiefs-Chief-Mark-Meadows/dp/1737478528/ref=sr_1_18?qid=1639355705&s=books&sr=1-18,History,"Mark Meadows, ",https://m.media-amazon.com/images/I/61v4w-EPDwL._AC_UY218_.jpg
Where the Deer and the Antelope Play: The Pastoral Observations of One Ignorant American Who Loves to Walk Outside,"Where the Deer and the Antelope Play: The Pastoral Observations of One Ignorant American Who Loves to Walk Outside funny, social, great, crazy, emotional, negative, political, minded, positive, inspirational,","funny, social, great, crazy, emotional, negative, political, minded, positive, inspirational,",https://www.amazon.com/Where-Deer-Antelope-Play-Observations/dp/1101984694/ref=sr_1_19?qid=1639355705&s=books&sr=1-19,History,"Nick Offerman, ",https://m.media-amazon.com/images/I/A1HG-57PUwL._AC_UY218_.jpg
Man's Search for Meaning,"Man's Search for Meaning bigoted, horrible, well, bored, unimaginable, repetitive, sad, happy, weak, strong,","bigoted, horrible, well, bored, unimaginable, repetitive, sad, happy, weak, strong,",https://www.amazon.com/Mans-Search-Meaning-Viktor-Frankl/dp/0807014273/ref=sr_1_20?qid=1639355705&s=books&sr=1-20,History,"Viktor E. Frankl, ",https://m.media-amazon.com/images/I/81QtGH9r1lL._AC_UY218_.jpg
Subpar Parks: America's Most Extraordinary National Parks and Their Least Impressed Visitors,"Subpar Parks: America's Most Extraordinary National Parks and Their Least Impressed Visitors gray, real, entire, rough, witty, short, typical, useful, funny, interesting,","gray, real, entire, rough, witty, short, typical, useful, funny, interesting,",https://www.amazon.com/Subpar-Parks-Americas-Extraordinary-Impressed/dp/0593185544/ref=sr_1_21?qid=1639355705&s=books&sr=1-21,History,"Amber Share, ",https://m.media-amazon.com/images/I/81RIp9usVfL._AC_UY218_.jpg
Booze & Vinyl: A Spirited Guide to Great Music and Mixed Drinks,"Booze & Vinyl: A Spirited Guide to Great Music and Mixed Drinks new, mediocre, well, excited, sticky, worn, nice, cool, double, shallow,","new, mediocre, well, excited, sticky, worn, nice, cool, double, shallow,",https://www.amazon.com/Booze-Vinyl-Spirited-Guide-Drinks/dp/0762463473/ref=sr_1_22?qid=1639355705&s=books&sr=1-22,History,"André Darlington, Tenaya Darlington, ",https://m.media-amazon.com/images/I/811Iz0PUfTL._AC_UY218_.jpg
Caste (Oprah's Book Club): The Origins of Our Discontents,"Caste (Oprah's Book Club): The Origins of Our Discontents racial, inherent, contemporary, political, balanced, muslim, protective, multiple, american, dominant,","racial, inherent, contemporary, political, balanced, muslim, protective, multiple, american, dominant,",https://www.amazon.com/Caste-Origins-Discontents-Isabel-Wilkerson/dp/0593230256/ref=sr_1_23?qid=1639355705&s=books&sr=1-23,History,"Isabel Wilkerson, ",https://m.media-amazon.com/images/I/81MVfud0o8L._AC_UY218_.jpg
Killing the Mob: The Fight Against Organized Crime in America (Bill O'Reilly's Killing Series),"Killing the Mob: The Fight Against Organized Crime in America (Bill O'Reilly's Killing Series) good, italian, disappointed, disappointing, big, late, small, gross, pure, dramatic,","good, italian, disappointed, disappointing, big, late, small, gross, pure, dramatic,",https://www.amazon.com/Killing-Mob-Against-Organized-OReillys/dp/125027365X/ref=sr_1_24?qid=1639355705&s=books&sr=1-24,History,"Martin Dugard, Bill O'Reilly, ",https://m.media-amazon.com/images/I/9131FGgieMS._AC_UY218_.jpg
"100 Parks, 5,000 Ideas: Where to Go, When to Go, What to See, What to Do","100 Parks, 5,000 Ideas: Where to Go, When to Go, What to See, What to Do great, best, closest, useful, beautiful, useless, helpful, specific, brief, nice,","great, best, closest, useful, beautiful, useless, helpful, specific, brief, nice,",https://www.amazon.com/100-Parks-000-Ideas-Where/dp/1426220103/ref=sr_1_25?qid=1639355705&s=books&sr=1-25,History,"Joe Yogerst, ",https://m.media-amazon.com/images/I/81vZGmwvTGL._AC_UY218_.jpg
Midnight in Washington: How We Almost Lost Our Democracy and Still Could,"Midnight in Washington: How We Almost Lost Our Democracy and Still Could baseless, russian, ukrainian, clear, ready, double, political, necessary, boring, big,","baseless, russian, ukrainian, clear, ready, double, political, necessary, boring, big,",https://www.amazon.com/Midnight-Washington-Almost-Democracy-Still/dp/059323152X/ref=sr_1_26?qid=1639355705&s=books&sr=1-26,History,"Adam Schiff, ",https://m.media-amazon.com/images/I/81rMWJVGyIL._AC_UY218_.jpg
The Spy and the Traitor: The Greatest Espionage Story of the Cold War,"The Spy and the Traitor: The Greatest Espionage Story of the Cold War beautiful, secret, easy, horrible, absurd, new, good, overwhelming, extraneous, trivial,","beautiful, secret, easy, horrible, absurd, new, good, overwhelming, extraneous, trivial,",https://www.amazon.com/Spy-Traitor-Greatest-Espionage-Story/dp/1101904216/ref=sr_1_27?qid=1639355705&s=books&sr=1-27,History,"Ben Macintyre, ",https://m.media-amazon.com/images/I/A1+ZZtoikDL._AC_UY218_.jpg
Led Zeppelin: The Biography,"Led Zeppelin: The Biography good, american, bad, unique, famous, glaring, mega, multiple, lazy, gross,","good, american, bad, unique, famous, glaring, mega, multiple, lazy, gross,",https://www.amazon.com/Led-Zeppelin-Biography-Bob-Spitz/dp/0399562427/ref=sr_1_28?qid=1639355705&s=books&sr=1-28,History,"Bob Spitz, ",https://m.media-amazon.com/images/I/81zvZSC3F9L._AC_UY218_.jpg
"The Bomber Mafia: A Dream, a Temptation, and the Longest Night of the Second World War","The Bomber Mafia: A Dream, a Temptation, and the Longest Night of the Second World War strategic, ferocious, second, human, great, japanese, fine, bad, wasteful, scholarly,","strategic, ferocious, second, human, great, japanese, fine, bad, wasteful, scholarly,",https://www.amazon.com/Bomber-Mafia-Temptation-Longest-Second/dp/0316296619/ref=sr_1_29?qid=1639355705&s=books&sr=1-29,History,"Malcolm Gladwell, ",https://m.media-amazon.com/images/I/511lXopfoLL._AC_UY218_.jpg
"The Splendid and the Vile: A Saga of Churchill, Family, and Defiance During the Blitz","The Splendid and the Vile: A Saga of Churchill, Family, and Defiance During the Blitz private, personal, good, real, impossible, bad, merry, sorry, huge, splendid,","private, personal, good, real, impossible, bad, merry, sorry, huge, splendid,",https://www.amazon.com/Splendid-Vile-Churchill-Family-Defiance/dp/0385348711/ref=sr_1_30?qid=1639355705&s=books&sr=1-30,History,"Erik Larson, ",https://m.media-amazon.com/images/I/91AyHD7e59L._AC_UY218_.jpg
It's Better to Be Feared: The New England Patriots Dynasty and the Pursuit of Greatness,"It's Better to Be Feared: The New England Patriots Dynasty and the Pursuit of Greatness sure, new, lifelong, convenient, literary, credible, close, breathless, ominous, favorite,","sure, new, lifelong, convenient, literary, credible, close, breathless, ominous, favorite,",https://www.amazon.com/Its-Better-Be-Feared-Greatness/dp/1631498231/ref=sr_1_31?qid=1639355705&s=books&sr=1-31,History,"Seth Wickersham, ",https://m.media-amazon.com/images/I/61OJsAavDrL._AC_UY218_.jpg
How the Word Is Passed: A Reckoning with the History of Slavery Across America,"How the Word Is Passed: A Reckoning with the History of Slavery Across America poor, bad, motivated, long, big, rear, personal, sad, neurotic, ill,","poor, bad, motivated, long, big, rear, personal, sad, neurotic, ill,",https://www.amazon.com/How-Word-Passed-Reckoning-History/dp/0316492930/ref=sr_1_32?qid=1639355705&s=books&sr=1-32,History,"Clint Smith, ",https://m.media-amazon.com/images/I/81LjfGLDMEL._AC_UY218_.jpg
"To Rescue the Republic: Ulysses S. Grant, the Fragile Union, and the Crisis of 1876","To Rescue the Republic: Ulysses S. Grant, the Fragile Union, and the Crisis of 1876 military, american, unnecessary, personal, political, absurd, late, nineteenth, real, woke,","military, american, unnecessary, personal, political, absurd, late, nineteenth, real, woke,",https://www.amazon.com/Rescue-Republic-Ulysses-Fragile-Crisis/dp/0063039540/ref=sr_1_17?qid=1639355805&s=books&sr=1-17,Politics & Social Sciences,"Bret Baier, ",https://m.media-amazon.com/images/I/81u8pA8kNEL._AC_UY218_.jpg
Peril,"Peril real, factual, great, big, half, complete, liberal, silly, casual, different,","real, factual, great, big, half, complete, liberal, silly, casual, different,",https://www.amazon.com/Peril-Bob-Woodward/dp/1982182911/ref=sr_1_18?qid=1639355805&s=books&sr=1-18,Politics & Social Sciences,"Bob Woodward, ",https://m.media-amazon.com/images/I/71gk+H+yEkL._AC_UY218_.jpg
