Title,Title_and_tag,Tag,Link,Category,Author,Image
"The House of Gucci: A Sensational Story of Murder, Madness, Glamour, and Greed","The House of Gucci: A Sensational Story of Murder, Madness, Glamour, and Greed uninteresting, intriguing, dry, interested, high, mundane, tedious, shallow, dull, trivial,","uninteresting, intriguing, dry, interested, high, mundane, tedious, shallow, dull, trivial,",https://www.amazon.com/House-Gucci-Sensational-Madness-Glamour/dp/0060937750/ref=sr_1_54?qid=1639413906&s=books&sr=1-54,Biographies,"Sara Gay Forden, ",https://m.media-amazon.com/images/I/61ImWT1rM4L._AC_UY218_.jpg
"True Crime Activity Book for Adults: Over 100 Activities To Learn More About Infamous Serial Killers And Their Horrific Crimes - Trivia, Puzzles, Coloring Pages, Memes & More (True Crime Gifts)","True Crime Activity Book for Adults: Over 100 Activities To Learn More About Infamous Serial Killers And Their Horrific Crimes - Trivia, Puzzles, Coloring Pages, Memes & More (True Crime Gifts) mon, existent, unreadable, sloppy, huge, worth, multiple, doable, fun, bad,","mon, existent, unreadable, sloppy, huge, worth, multiple, doable, fun, bad,",https://www.amazon.com/True-Crime-Activity-Book-Adults/dp/1801011222/ref=sr_1_55?qid=1639413906&s=books&sr=1-55,Biographies,"Brian Berry, ",https://m.media-amazon.com/images/I/61xnx2NG6NL._AC_UY218_.jpg
"2022 The Legacy of Ruth Bader Ginsburg Wall Calendar: Her Words of Hope, Equality and Inspiration ― A yearlong tribute to the notorious RBG (12-Month Monthly Calendar)","2022 The Legacy of Ruth Bader Ginsburg Wall Calendar: Her Words of Hope, Equality and Inspiration ― A yearlong tribute to the notorious RBG (12-Month Monthly Calendar) mini, awesome, bent, awful, uncomfortable, 4th, reasonable, big, small, padded,","mini, awesome, bent, awful, uncomfortable, 4th, reasonable, big, small, padded,",https://www.amazon.com/2022-Legacy-Bader-Ginsburg-Calendar/dp/172824658X/ref=sr_1_56?qid=1639413906&s=books&sr=1-56,Biographies,"Sourcebooks, ",https://m.media-amazon.com/images/I/81RSsqSiPdL._AC_UY218_.jpg
The Anthropocene Reviewed (Signed Edition): Essays on a Human-Centered Planet,"The Anthropocene Reviewed (Signed Edition): Essays on a Human-Centered Planet interesting, half, high, numerous, physical, mental, moral, narcissistic, dry, ideological,","interesting, half, high, numerous, physical, mental, moral, narcissistic, dry, ideological,",https://www.amazon.com/Anthropocene-Reviewed-Signed-John-Green/dp/0525555218/ref=sr_1_57?qid=1639413906&s=books&sr=1-57,Biographies,"John Green, ",https://m.media-amazon.com/images/I/A1WuKJcRANL._AC_UY218_.jpg
Educated: A Memoir,"Educated: A Memoir good, weak, terrible, white, red, bloody, unconscious, hard, basic, hollow,","good, weak, terrible, white, red, bloody, unconscious, hard, basic, hollow,",https://www.amazon.com/Educated-Memoir-Tara-Westover/dp/0399590501/ref=sr_1_58?qid=1639413906&s=books&sr=1-58,Biographies,"Tara Westover, ",https://m.media-amazon.com/images/I/81NwOj14S6L._AC_UY218_.jpg
All of the Marvels: A Journey to the Ends of the Biggest Story Ever Told,"All of the Marvels: A Journey to the Ends of the Biggest Story Ever Told good, white, right, bad, early, true, 21st, personal, major, middle,","good, white, right, bad, early, true, 21st, personal, major, middle,",https://www.amazon.com/All-Marvels-Journey-Biggest-Story/dp/0735222169/ref=sr_1_59?qid=1639413906&s=books&sr=1-59,Biographies,"Douglas Wolk, ",https://m.media-amazon.com/images/I/71B5JhniaLS._AC_UY218_.jpg
The Big Book of Serial Killers (An Encyclopedia of Serial Killers),"The Big Book of Serial Killers (An Encyclopedia of Serial Killers) fine, good, interesting, little, great, basic, photographic, infamous, long, bland,","fine, good, interesting, little, great, basic, photographic, infamous, long, bland,",https://www.amazon.com/Big-Book-Serial-Killers/dp/1548119644/ref=sr_1_60?qid=1639413906&s=books&sr=1-60,Biographies,"Jack Rosewood, ",https://m.media-amazon.com/images/I/61C-T00vFTS._AC_UY218_.jpg
"2022 History Channel Unexplained Mysteries Boxed Calendar: Inexplicable Events, Strange Disappearances, Baffling Phenomena(Daily Calendar, Desk Gift for True Crime Fan) (Moments in HISTORY® Calendars)","2022 History Channel Unexplained Mysteries Boxed Calendar: Inexplicable Events, Strange Disappearances, Baffling Phenomena(Daily Calendar, Desk Gift for True Crime Fan) (Moments in HISTORY® Calendars) thin, disappointed,","thin, disappointed,",https://www.amazon.com/History-Channel-Unexplained-Mysteries-Calendar/dp/1728231388/ref=sr_1_61?qid=1639413906&s=books&sr=1-61,Biographies,"History Channel, ",https://m.media-amazon.com/images/I/81pH5VSNRVL._AC_UY218_.jpg
Into the Abyss: An Extraordinary True Story,"Into the Abyss: An Extraordinary True Story deceased, clear, isolated, glad, free, great, wrong, bored, dramatic, fast,","deceased, clear, isolated, glad, free, great, wrong, bored, dramatic, fast,",https://www.amazon.com/Into-Abyss-Extraordinary-True-Story/dp/1455501964/ref=sr_1_62?qid=1639413906&s=books&sr=1-62,Biographies,"Carol Shaben, ",https://m.media-amazon.com/images/I/5121z9ziLTL._AC_UY218_.jpg
The Ultimate Pittsburgh Steelers Trivia Book: A Collection of Amazing Trivia Quizzes and Fun Facts for Die-Hard Steelers Fans!,"The Ultimate Pittsburgh Steelers Trivia Book: A Collection of Amazing Trivia Quizzes and Fun Facts for Die-Hard Steelers Fans! famous, avid, thrilled, good, weird, terrible, old, worldwide, loyal, second,","famous, avid, thrilled, good, weird, terrible, old, worldwide, loyal, second,",https://www.amazon.com/Ultimate-Pittsburgh-Steelers-Trivia-Book/dp/1953563066/ref=sr_1_63?qid=1639413906&s=books&sr=1-63,Biographies,"Ray Walker, ",https://m.media-amazon.com/images/I/71zVly3uMDL._AC_UY218_.jpg
This Must Be the Place: Dispatches & Food from the Home Front,"This Must Be the Place: Dispatches & Food from the Home Front real, icky, surprised,","real, icky, surprised,",https://www.amazon.com/This-Must-Be-Place-Dispatches/dp/0593357213/ref=sr_1_64?qid=1639413906&s=books&sr=1-64,Biographies,"Rachael Ray, ",https://m.media-amazon.com/images/I/91uTSznInKL._AC_UY218_.jpg
"Leviathan Falls: Expanse, Book 9","Leviathan Falls: Expanse, Book 9 old, present, early, big, strong, bad, weak, well, favorite, unfinished,","old, present, early, big, strong, bad, weak, well, favorite, unfinished,",https://www.amazon.com/Leviathan-Falls-Expanse-Book-9/dp/B0971RBRV8/ref=sr_1_49?qid=1639414000&s=books&sr=1-49,Literature & Fiction,"James S.A. Corey, ",https://m.media-amazon.com/images/I/91cdp3VglTL._AC_UY218_.jpg
Chronicles of Narnia Box Set,"Chronicles of Narnia Box Set unknown, eastern, padded, large, small, ridiculous, new, mysterious, narrative, familiar,","unknown, eastern, padded, large, small, ridiculous, new, mysterious, narrative, familiar,",https://www.amazon.com/Chronicles-Narnia-Box-Set-Lewis/dp/0061992887/ref=sr_1_50?qid=1639414000&s=books&sr=1-50,Literature & Fiction,"C. S. Lewis, ",https://m.media-amazon.com/images/I/81-IdKd6SzL._AC_UY218_.jpg
The Sentence,"The Sentence real, current, american, unknown, afraid, pretentious, endless, annoying, condescending, native,","real, current, american, unknown, afraid, pretentious, endless, annoying, condescending, native,",https://www.amazon.com/Sentence-Louise-Erdrich/dp/006267112X/ref=sr_1_51?qid=1639414000&s=books&sr=1-51,Literature & Fiction,"Louise Erdrich, ",https://m.media-amazon.com/images/I/81rfl9xrwIS._AC_UY218_.jpg
Xanathar's Guide to Everything (Dungeons & Dragons),"Xanathar's Guide to Everything (Dungeons & Dragons) new, common, different, welcome, 5th, 4th, big, likely, nice, vital,","new, common, different, welcome, 5th, 4th, big, likely, nice, vital,",https://www.amazon.com/Xanathars-Guide-Everything-Wizards-Team/dp/0786966114/ref=sr_1_52?qid=1639414000&s=books&sr=1-52,Literature & Fiction,"Wizards RPG Team, ",https://m.media-amazon.com/images/I/81objtUow1L._AC_UY218_.jpg
All the Light We Cannot See: A Novel,"All the Light We Cannot See: A Novel fantastic, short, present, different, average, historical, beautiful, tough, palpable, enjoyable,","fantastic, short, present, different, average, historical, beautiful, tough, palpable, enjoyable,",https://www.amazon.com/All-Light-We-Cannot-See/dp/1501173219/ref=sr_1_53?qid=1639414000&s=books&sr=1-53,Literature & Fiction,"Anthony Doerr, ",https://m.media-amazon.com/images/I/81vu0URIVOL._AC_UY218_.jpg
Better Off Dead: A Jack Reacher Novel,"Better Off Dead: A Jack Reacher Novel stupid, second, dull, real, cryptic, good, original, apt, physical, horrible,","stupid, second, dull, real, cryptic, good, original, apt, physical, horrible,",https://www.amazon.com/Better-Off-Dead-Reacher-Novel-ebook/dp/B08SBMCSQQ/ref=sr_1_54?qid=1639414000&s=books&sr=1-54,Literature & Fiction,"Lee Child, ",https://m.media-amazon.com/images/I/81s62RyNcUL._AC_UY218_.jpg
Clarity & Connection,"Clarity & Connection nice, real, excited, bent,","nice, real, excited, bent,",https://www.amazon.com/Clarity-Connection-Yung-Pueblo/dp/1524860484/ref=sr_1_55?qid=1639414000&s=books&sr=1-55,Literature & Fiction,"Yung Pueblo, ",https://m.media-amazon.com/images/I/61pLZSc0vmL._AC_UY218_.jpg
Dungeons & Dragons Essentials Kit (D&D Boxed Set),"Dungeons & Dragons Essentials Kit (D&D Boxed Set) multiple, magic, hard, firm, easy, gentle, wet, ok, cheap, great,","multiple, magic, hard, firm, easy, gentle, wet, ok, cheap, great,",https://www.amazon.com/Dungeons-Dragons-Essentials-Kit-Boxed/dp/0786966831/ref=sr_1_56?qid=1639414000&s=books&sr=1-56,Literature & Fiction,"Wizards RPG Team, ",https://m.media-amazon.com/images/I/815VKqxBGQL._AC_UY218_.jpg
Dune Messiah,"Dune Messiah political, compelling, true, 1st, original, interesting, long, generous, foreseen, religious,","political, compelling, true, 1st, original, interesting, long, generous, foreseen, religious,",https://www.amazon.com/Dune-Messiah-Frank-Herbert-audiobook/dp/B000WS9ZHY/ref=sr_1_57?qid=1639414000&s=books&sr=1-57,Literature & Fiction,"Frank Herbert, ",https://m.media-amazon.com/images/I/81paeYYep3L._AC_UY218_.jpg
Spectacular Stories for Curious Kids: A Fascinating Collection of True Stories to Inspire & Amaze Young Readers,"Spectacular Stories for Curious Kids: A Fascinating Collection of True Stories to Inspire & Amaze Young Readers kid, good, young, friendly,","kid, good, young, friendly,",https://www.amazon.com/Spectacular-Stories-Curious-Kids-Fascinating/dp/1953429130/ref=sr_1_58?qid=1639414000&s=books&sr=1-58,Literature & Fiction,"Jesse Sullivan, ",https://m.media-amazon.com/images/I/71mkqMwEZwL._AC_UY218_.jpg
Where the Deer and the Antelope Play: The Pastoral Observations of One Ignorant American Who Loves to Walk Outside,"Where the Deer and the Antelope Play: The Pastoral Observations of One Ignorant American Who Loves to Walk Outside funny, social, great, crazy, emotional, negative, political, minded, positive, inspirational,","funny, social, great, crazy, emotional, negative, political, minded, positive, inspirational,",https://www.amazon.com/Where-Deer-Antelope-Play-Observations/dp/1101984694/ref=sr_1_59?qid=1639414000&s=books&sr=1-59,Literature & Fiction,"Nick Offerman, ",https://m.media-amazon.com/images/I/A1HG-57PUwL._AC_UY218_.jpg
Glitter Every Day: 365 Quotes from Women I Love,"Glitter Every Day: 365 Quotes from Women I Love boring, new, cute, purple, colorful, fine,","boring, new, cute, purple, colorful, fine,",https://www.amazon.com/Glitter-Every-Day-Quotes-Women/dp/125083239X/ref=sr_1_60?qid=1639414000&s=books&sr=1-60,Literature & Fiction,"Andy Cohen, ",https://m.media-amazon.com/images/I/91RDZzeAlSL._AC_UY218_.jpg
Redeeming Love,"Redeeming Love christian, emotional, abusive, disturbing, incredible, male, physical, good, sexual, tragic,","christian, emotional, abusive, disturbing, incredible, male, physical, good, sexual, tragic,",https://www.amazon.com/Redeeming-Love-Francine-Rivers/dp/1590525132/ref=sr_1_62?qid=1639414000&s=books&sr=1-62,Literature & Fiction,"Francine Rivers, ",https://m.media-amazon.com/images/I/81eq72dnfcL._AC_UY218_.jpg
Harlem Shuffle: A Novel,"Harlem Shuffle: A Novel true, main, cohesive, superior, huge, riveting, sympathetic, likable, flawed, wealthy,","true, main, cohesive, superior, huge, riveting, sympathetic, likable, flawed, wealthy,",https://www.amazon.com/Harlem-Shuffle-Novel-Colson-Whitehead/dp/0385545134/ref=sr_1_63?qid=1639414000&s=books&sr=1-63,Literature & Fiction,"Colson Whitehead, ",https://m.media-amazon.com/images/I/91Mj6CdzCgL._AC_UY218_.jpg
The Hill We Climb: An Inaugural Poem for the Country,"The Hill We Climb: An Inaugural Poem for the Country powerful, disappointed, beautiful, thin, bold, terrible, inaugural, perfect, little, happy,","powerful, disappointed, beautiful, thin, bold, terrible, inaugural, perfect, little, happy,",https://www.amazon.com/Hill-We-Climb-Inaugural-Country/dp/059346527X/ref=sr_1_64?qid=1639414000&s=books&sr=1-64,Literature & Fiction,"Amanda Gorman, ",https://m.media-amazon.com/images/I/91QclGg4BjL._AC_UY218_.jpg
The Chancellor: The Remarkable Odyssey of Angela Merkel,"The Chancellor: The Remarkable Odyssey of Angela Merkel simple, chatty, personal, good, akin, central, common, new, old, german,","simple, chatty, personal, good, akin, central, common, new, old, german,",https://www.amazon.com/Chancellor-Remarkable-Odyssey-Angela-Merkel/dp/1501192620/ref=sr_1_49?qid=1639414117&s=books&sr=1-49,History,"Kati Marton, ",https://m.media-amazon.com/images/I/71Kv9GiKWeL._AC_UY218_.jpg
The Premonition: A Pandemic Story,"The Premonition: A Pandemic Story public, historical, hard, great, pandemic, good, bad, incompetent, local, trump,","public, historical, hard, great, pandemic, good, bad, incompetent, local, trump,",https://www.amazon.com/Premonition-Pandemic-Story-Michael-Lewis/dp/0393881555/ref=sr_1_50?qid=1639414117&s=books&sr=1-50,History,"Michael Lewis, ",https://m.media-amazon.com/images/I/51y4sn12xoS._AC_UY218_.jpg
The Joy of Pizza: Everything You Need to Know,"The Joy of Pizza: Everything You Need to Know nice, sure, olive, multiple, large, worth, great, good, different, complex,","nice, sure, olive, multiple, large, worth, great, good, different, complex,",https://www.amazon.com/Joy-Pizza-Everything-Need-Know/dp/0316462411/ref=sr_1_51?qid=1639414117&s=books&sr=1-51,History,"Katie Parla, Dan Richer, ",https://m.media-amazon.com/images/I/91+nY5490oL._AC_UY218_.jpg
Into the Wild,"Into the Wild free, white, stupid, pointless, concerned, ultimate, eloquent, detailed, eccentric, brilliant,","free, white, stupid, pointless, concerned, ultimate, eloquent, detailed, eccentric, brilliant,",https://www.amazon.com/Into-Wild-Jon-Krakauer-ebook/dp/B000SEFNMS/ref=sr_1_52?qid=1639414117&s=books&sr=1-52,History,"Jon Krakauer, ",https://m.media-amazon.com/images/I/81HE66LwqQL._AC_UY218_.jpg
National Geographic Atlas of the National Parks,"National Geographic Atlas of the National Parks high, good, well, thick, authoritative, multi, faceted, informative, previous, disappointing,","high, good, well, thick, authoritative, multi, faceted, informative, previous, disappointing,",https://www.amazon.com/National-Geographic-Atlas-Parks/dp/142622057X/ref=sr_1_53?qid=1639414117&s=books&sr=1-53,History,"Jon Waterman, ",https://m.media-amazon.com/images/I/812VzBQBSoL._AC_UY218_.jpg
The World War 2 Trivia Book: Interesting Stories and Random Facts from the Second World War (Trivia War Books),"The World War 2 Trivia Book: Interesting Stories and Random Facts from the Second World War (Trivia War Books) trivia, inaccurate, fine, small, outrageous, intelligent, social, buzz, important, unmentioned,","trivia, inaccurate, fine, small, outrageous, intelligent, social, buzz, important, unmentioned,",https://www.amazon.com/World-War-Trivia-Book-Interesting/dp/1978451652/ref=sr_1_54?qid=1639414117&s=books&sr=1-54,History,"Bill O'Neill, ",https://m.media-amazon.com/images/I/71u7UpeuOuS._AC_UY218_.jpg
The Last King of America: The Misunderstood Reign of George III,"The Last King of America: The Misunderstood Reign of George III free, adhesive,","free, adhesive,",https://www.amazon.com/Last-King-America-Misunderstood-George/dp/198487926X/ref=sr_1_55?qid=1639414117&s=books&sr=1-55,History,"Andrew Roberts, ",https://m.media-amazon.com/images/I/91KC1EGHKoL._AC_UY218_.jpg
"Atlas Obscura, 2nd Edition: An Explorer's Guide to the World's Hidden Wonders","Atlas Obscura, 2nd Edition: An Explorer's Guide to the World's Hidden Wonders terrible, good, new, great, interesting, well, little, pricey, exciting, black,","terrible, good, new, great, interesting, well, little, pricey, exciting, black,",https://www.amazon.com/Atlas-Obscura-2nd-Explorers-Wonders/dp/1523506482/ref=sr_1_56?qid=1639414117&s=books&sr=1-56,History,"Joshua Foer, ",https://m.media-amazon.com/images/I/814X6doZlZL._AC_UY218_.jpg
The Lyrics: 1956 to the Present,"The Lyrics: 1956 to the Present good, musical, bumped, decent, odd, important, mere, late, big, large,","good, musical, bumped, decent, odd, important, mere, late, big, large,",https://www.amazon.com/Lyrics-1956-Present-Paul-McCartney/dp/0241519330/ref=sr_1_57?qid=1639414117&s=books&sr=1-57,History,"Paul McCartney, ",https://m.media-amazon.com/images/I/81tidVJ7NFS._AC_UY218_.jpg
Unguarded,"Unguarded lifelong, deep, negative, bitter, honest, immature, sensitive, true, childish, bad,","lifelong, deep, negative, bitter, honest, immature, sensitive, true, childish, bad,",https://www.amazon.com/Unguarded-Scottie-Pippen/dp/1982165197/ref=sr_1_58?qid=1639414117&s=books&sr=1-58,History,"Scottie Pippen, ",https://m.media-amazon.com/images/I/81K3DYf-5yL._AC_UY218_.jpg
A Promised Land,"A Promised Land good, moderate, long, well, disappointed, wrong, marvelous, narcissistic, sure, bad,","good, moderate, long, well, disappointed, wrong, marvelous, narcissistic, sure, bad,",https://www.amazon.com/A-Promised-Land-Obama-Audiobook/dp/B08HGH9JMF/ref=sr_1_59?qid=1639414117&s=books&sr=1-59,History,"Barack Obama, ",https://m.media-amazon.com/images/I/81NI6sqvvkL._AC_UY218_.jpg
Kitchen Confidential Updated Edition: Adventures in the Culinary Underbelly (P.S.),"Kitchen Confidential Updated Edition: Adventures in the Culinary Underbelly (P.S.) plain, big, tough, competitive, interesting, well, exotic, rough, questionable, famous,","plain, big, tough, competitive, interesting, well, exotic, rough, questionable, famous,",https://www.amazon.com/Kitchen-Confidential-Updated-Adventures-Underbelly/dp/0060899220/ref=sr_1_60?qid=1639414117&s=books&sr=1-60,History,"Anthony Bourdain, ",https://m.media-amazon.com/images/I/71yZeQIl1wL._AC_UY218_.jpg
Firearms: An Illustrated History,"Firearms: An Illustrated History historical, bad, plastic, soft, dirty, cool, happy, beautiful, excellent, useless,","historical, bad, plastic, soft, dirty, cool, happy, beautiful, excellent, useless,",https://www.amazon.com/Firearms-Illustrated-History-DK/dp/1465416056/ref=sr_1_61?qid=1639414117&s=books&sr=1-61,History,"DK, ",https://m.media-amazon.com/images/I/91G8EbYWZHL._AC_UY218_.jpg
On Tyranny Graphic Edition: Twenty Lessons from the Twentieth Century,"On Tyranny Graphic Edition: Twenty Lessons from the Twentieth Century disappointed, new, clear, small, understandable, illegible, high, initial, focused, confused,","disappointed, new, clear, small, understandable, illegible, high, initial, focused, confused,",https://www.amazon.com/Tyranny-Graphic-Lessons-Twentieth-Century/dp/1984859153/ref=sr_1_62?qid=1639414117&s=books&sr=1-62,History,"Timothy Snyder, Nora Krug, ",https://m.media-amazon.com/images/I/91q6RZ8AosL._AC_UY218_.jpg
Talking to Strangers: What We Should Know About the People We Don't Know,"Talking to Strangers: What We Should Know About the People We Don't Know strange, narrow, mistaken, new, worthy, past, american, sexual, severe, pre,","strange, narrow, mistaken, new, worthy, past, american, sexual, severe, pre,",https://www.amazon.com/Talking-to-Strangers-audiobook/dp/B07NJCG1XS/ref=sr_1_63?qid=1639414117&s=books&sr=1-63,History,"Malcolm Gladwell, ",https://m.media-amazon.com/images/I/718yLJJH0vL._AC_UY218_.jpg
Becoming,"Becoming shallow, minded, wrong, real, silly, good, congratulatory, predictable, great, proud,","shallow, minded, wrong, real, silly, good, congratulatory, predictable, great, proud,",https://www.amazon.com/Becoming-Michelle-Obama-audiobook/dp/B07B3JQZCL/ref=sr_1_64?qid=1639414117&s=books&sr=1-64,History,"Michelle Obama, ",https://m.media-amazon.com/images/I/81bFNmhKrTL._AC_UY218_.jpg
Fahrenheit 451,"Fahrenheit 451 accurate, social, little, bad, future, disappointed, original, obvious, egregious, dumb,","accurate, social, little, bad, future, disappointed, original, obvious, egregious, dumb,",https://www.amazon.com/Fahrenheit-451-Ray-Bradbury/dp/1451673310/ref=sr_1_49?qid=1639414202&s=books&sr=1-49,Politics & Social Sciences,"Ray Bradbury, ",https://m.media-amazon.com/images/I/71OFqSRFDgL._AC_UY218_.jpg
All of the Marvels: A Journey to the Ends of the Biggest Story Ever Told,"All of the Marvels: A Journey to the Ends of the Biggest Story Ever Told good, white, right, bad, early, true, 21st, personal, major, middle,","good, white, right, bad, early, true, 21st, personal, major, middle,",https://www.amazon.com/All-Marvels-Journey-Biggest-Story/dp/0735222169/ref=sr_1_50?qid=1639414202&s=books&sr=1-50,Politics & Social Sciences,"Douglas Wolk, ",https://m.media-amazon.com/images/I/71B5JhniaLS._AC_UY218_.jpg
Astrology for Teens: Understanding Your Relationship to the Universe,"Astrology for Teens: Understanding Your Relationship to the Universe clear, difficult, particular, mid, italic, bold, sure, hard, frustrating, simple,","clear, difficult, particular, mid, italic, bold, sure, hard, frustrating, simple,",https://www.amazon.com/Astrology-Teens-Understanding-Relationship-Universe/dp/1955423814/ref=sr_1_52?qid=1639414202&s=books&sr=1-52,Politics & Social Sciences,"Discover Press, ",https://m.media-amazon.com/images/I/61Mi+52fwiL._AC_UY218_.jpg
The Oxford Companion to Spirits and Cocktails,"The Oxford Companion to Spirits and Cocktails dark, gloomy, interesting, main, practical, average, real,","dark, gloomy, interesting, main, practical, average, real,",https://www.amazon.com/Oxford-Companion-Spirits-Cocktails/dp/0199311137/ref=sr_1_53?qid=1639414202&s=books&sr=1-53,Politics & Social Sciences,"Noah Rothbaum, David Wondrich, ",https://m.media-amazon.com/images/I/41iBatv4piL._AC_UY218_.jpg
"How to Talk to Your Cat About Gun Safety: And Abstinence, Drugs, Satanism, and Other Dangers That Threaten Their Nine Lives","How to Talk to Your Cat About Gun Safety: And Abstinence, Drugs, Satanism, and Other Dangers That Threaten Their Nine Lives cute, funny, excited, hilarious, glad, fundamentalist, firm, 1st, light, awful,","cute, funny, excited, hilarious, glad, fundamentalist, firm, 1st, light, awful,",https://www.amazon.com/How-Talk-Your-About-Safety/dp/045149492X/ref=sr_1_54?qid=1639414202&s=books&sr=1-54,Politics & Social Sciences,"Zachary Auburn, ",https://m.media-amazon.com/images/I/81PuZCZsPrL._AC_UY218_.jpg
Into the Abyss: An Extraordinary True Story,"Into the Abyss: An Extraordinary True Story deceased, clear, isolated, glad, free, great, wrong, bored, dramatic, fast,","deceased, clear, isolated, glad, free, great, wrong, bored, dramatic, fast,",https://www.amazon.com/Into-Abyss-Extraordinary-True-Story/dp/1455501964/ref=sr_1_55?qid=1639414202&s=books&sr=1-55,Politics & Social Sciences,"Carol Shaben, ",https://m.media-amazon.com/images/I/5121z9ziLTL._AC_UY218_.jpg
Tinderbox: HBO's Ruthless Pursuit of New Frontiers,"Tinderbox: HBO's Ruthless Pursuit of New Frontiers interesting, unreadable, black, interested, entire, cool, considerable, old, white, cultural,","interesting, unreadable, black, interested, entire, cool, considerable, old, white, cultural,",https://www.amazon.com/Tinderbox-HBOs-Ruthless-Pursuit-Frontiers/dp/1250624010/ref=sr_1_56?qid=1639414202&s=books&sr=1-56,Politics & Social Sciences,"James Andrew Miller, ",https://m.media-amazon.com/images/I/91nCf4I5DLL._AC_UY218_.jpg
Beyond Biden: Rebuilding the America We Love,"Beyond Biden: Rebuilding the America We Love typical, bad, current, political, aware, token, good, warm, fuzzy, boring,","typical, bad, current, political, aware, token, good, warm, fuzzy, boring,",https://www.amazon.com/Beyond-Biden-Rebuilding-America-Love/dp/1546000259/ref=sr_1_57?qid=1639414202&s=books&sr=1-57,Politics & Social Sciences,"Newt Gingrich, ",https://m.media-amazon.com/images/I/61RWe839a0L._AC_UY218_.jpg
Animal Crossing: New Horizons 2022 Day-to-Day Calendar,"Animal Crossing: New Horizons 2022 Day-to-Day Calendar honest, good, new, disappointed, little, persistent, clear, strong, satisfied, mad,","honest, good, new, disappointed, little, persistent, clear, strong, satisfied, mad,",https://www.amazon.com/Animal-Crossing-Horizons-Day-Day/dp/1419754920/ref=sr_1_58?qid=1639414202&s=books&sr=1-58,Politics & Social Sciences,"Nintendo, ",https://m.media-amazon.com/images/I/71nqrdj4NoL._AC_UY218_.jpg
"Maid: Hard Work, Low Pay, and a Mother's Will to Survive","Maid: Hard Work, Low Pay, and a Mother's Will to Survive real, angry, basic, main, big, desperate, single, high, bad, hard,","real, angry, basic, main, big, desperate, single, high, bad, hard,",https://www.amazon.com/Maid-Hard-Work-Mothers-Survive/dp/0316505099/ref=sr_1_59?qid=1639414202&s=books&sr=1-59,Politics & Social Sciences,"Stephanie Land, ",https://m.media-amazon.com/images/I/71GB-yyM8jL._AC_UY218_.jpg
